text,labels,is_ood
add step to me to the 50 clásicos playlist ,AddToPlaylist,0
please add iris dement to my playlist this is selena,AddToPlaylist,0
add slimm cutta calhoun to my this is prince playlist  ,AddToPlaylist,0
i need a forecast for jetmore  massachusetts in 1 hour and 1 second from now,GetWeather,0
please let me know the weather forcast of stanislaus national forest far in nine months,GetWeather,0
add to playlist confidence boost here comes santa claus,AddToPlaylist,0
add another artist to the spotlight on country 2016 playlist  ,AddToPlaylist,0
add sugarolly days to my list  your favorite slaughterhouse,AddToPlaylist,0
add this track to my global funk,AddToPlaylist,0
add manuelita to my indiespensables playlist,AddToPlaylist,0
what s the weather in my current spot the day after tomorrow,GetWeather,0
add this artist to gretchen s soul revived playlist,AddToPlaylist,0
what is the weather like in the city of frewen in the country of venezuela,GetWeather,0
put this song on my playlist  in the name of blues ,AddToPlaylist,0
will it be colder in ohio,GetWeather,0
add rak biszewilo to my playlist named jazz,AddToPlaylist,0
what is the weather not far from upper klamath national wildlife refuge,GetWeather,0
add falling upstairs to the playlist named chill out,AddToPlaylist,0
will it storm in charles pinckney national historic site,GetWeather,0
add the entire album into indie español,AddToPlaylist,0
add this album to the playlist called dishwashing,AddToPlaylist,0
is it supposed to rain nearby my current location at 0 o clock,GetWeather,0
put playa fly onto my 2010 decade playlist,AddToPlaylist,0
add bret mckenzie to my pop commute playlist,AddToPlaylist,0
what is the weather supposed to be like in new jersey three months from now,GetWeather,0
add this song to my playlist named wild country,AddToPlaylist,0
add artist to lo mejor de los 00 s,AddToPlaylist,0
i d like johnny nash to be put into my playlist always pop punk,AddToPlaylist,0
put this album in shuffle syndrome,AddToPlaylist,0
add a track to my hands up playlist ,AddToPlaylist,0
will it be warmer now in covenant life,GetWeather,0
add rosemary clooney to pura vida playlist,AddToPlaylist,0
add tune to my hype playlist,AddToPlaylist,0
add por una cabeza to my playlist called this is new edition,AddToPlaylist,0
add wastedagain to the wild & free workout playlist,AddToPlaylist,0
add this track to duetos,AddToPlaylist,0
add the song to the dub on the beach playlist,AddToPlaylist,0
will it be humid in beedeville on november 20,GetWeather,0
put deep purple on this is jennifer lopez,AddToPlaylist,0
what is the weather in sint maarten,GetWeather,0
add this track to the classical music for smart kids playlist,AddToPlaylist,0
weather for close-by parc national de kolkheti,GetWeather,0
add om to my classic punk,AddToPlaylist,0
what will the weather be like 19 minutes from now in nepal,GetWeather,0
include laarni lozada on endorphin rush playlist,AddToPlaylist,0
add my track to old school metal playlist,AddToPlaylist,0
what s the weather forecast for moss hill,GetWeather,0
what will the weather be like not far from alabama on may 9  2037,GetWeather,0
ethiopia ellenton has snow weather at eight pm,GetWeather,0
i want to add a song by w c clark to my nerding around playlist,AddToPlaylist,0
add parempi mies to the café con leche playlist  ,AddToPlaylist,0
put this track on alok house party playlist,AddToPlaylist,0
what s the weather going to be in 7 hours in fm,GetWeather,0
add the crabfish to my playlist called the sleep machine rainforest,AddToPlaylist,0
what is the forecast for cold temps in nevada,GetWeather,0
add heresy and the hotel choir to the evening acoustic playlist,AddToPlaylist,0
add songs tune in reggae infusions,AddToPlaylist,0
book a restaurant on june the fifth in cavour ,GetWeather,0
add the patty patty sound  to my metal talks kreator playlist,AddToPlaylist,0
give me the weather forecast for lower lake on sep  21  2038,GetWeather,0
add slave to the rhythm to the playlist massive soca hits,AddToPlaylist,0
add the block brochure welcome to the soil 6 onto my café con leche list,AddToPlaylist,0
what will the weather be at my current location on december the 2nd  2029,GetWeather,0
add testifying to  donna s tokyo rising palylist,AddToPlaylist,0
add dr know to my todo alternativo playlist  ,AddToPlaylist,0
add the name cry like a baby to my a mis niños de 30 playlist,AddToPlaylist,0
add matthew helders artist in showstopper being mary jane,AddToPlaylist,0
what is the forecast for temperate weather in bellechester,GetWeather,0
add this track to new hip hop,AddToPlaylist,0
add a track to my classical feast playlist ,AddToPlaylist,0
add a kj 52 track to the te quiero playlist  ,AddToPlaylist,0
add the lady bunny album to décadas,AddToPlaylist,0
add a tune to my this is marc anthony playlist,AddToPlaylist,0
is there going to be a depression two hundred sixteen days and a half from now in mill bluff state park,GetWeather,0
what is the forecast for west virginia will it be snowy,GetWeather,0
what s the forecast for alley  canada,GetWeather,0
can you put this track onto the playlist the selektor,AddToPlaylist,0
what s the weather forecast not far from here ,GetWeather,0
add image to the nuclear blast novelties playlist,AddToPlaylist,0
what s the weather for april 10th  2028 in arkansas,GetWeather,0
will it be stormy in ritchey in palau,GetWeather,0
is it hot in gold beach  bahrain ,GetWeather,0
can you please give me the forecast for the dominica,GetWeather,0
what is the forecast for sea isle city in louisiana for warmer weather,GetWeather,0
add the second three years to my workout twerkout playlist,AddToPlaylist,0
forecast for hardinsburg 20 seconds from now,GetWeather,0
add lisa dalbello to my 2015 cma awards nominees list,AddToPlaylist,0
what s the weather in stamps,GetWeather,0
add tune to my this is animal collective,AddToPlaylist,0
i want the weather for saint martin next year,GetWeather,0
add nour mhanna to workday lounge,AddToPlaylist,0
add natasha to my all things post playlist,AddToPlaylist,0
add the piano bar to my cindy wilson,AddToPlaylist,0
will it rain here at 13:22:09,GetWeather,0
can you add esquivando charcos to my playlist entitled the piano bar,AddToPlaylist,0
can you add woman of the world to my playlist entitled duetos,AddToPlaylist,0
add hold my liquor to electronow,AddToPlaylist,0
what s the weather in la pine,GetWeather,0
can you add some disco to my playlist called genuine r&b,AddToPlaylist,0
add split the difference to my women s lit playlist,AddToPlaylist,0
what is the forecast for the current spot for cloudy conditions,GetWeather,0
is it going to be cold today in wing,GetWeather,0
what will the weather be like in port clinton  nebraska around midnight,GetWeather,0
will there be rain next year in new hampshire,GetWeather,0
is it forecast to be freezing in benedict,GetWeather,0
how chilly is it close to hollidaysburg,GetWeather,0
add blood guts & glory to my this is chopin,AddToPlaylist,0
add deuce to my listas de éxitos playlist,AddToPlaylist,0
put molly and tenbrooks in the french n  heavy playlist  ,AddToPlaylist,0
what is the american samoa forecast for hot weather,GetWeather,0
add warpaint in my pre-party list,AddToPlaylist,0
add a tom thacker tune to my rock classics,AddToPlaylist,0
tell me the weather forecast for here,GetWeather,0
add this song to my crossroad blues playlist,AddToPlaylist,0
add an artist to the décadas playlist ,AddToPlaylist,0
what will the weather be like on feb  8  2034 in cedar mountain wilderness,GetWeather,0
what s the weather going to be like near moldova on fri ,GetWeather,0
add a-hunting we will go to the emily dickinson playlist,AddToPlaylist,0
what is the weather in sehlabathebe-nationalpark,GetWeather,0
add this tune by harry connick jr to my jazz brasileiro playlist,AddToPlaylist,0
will it be hot in saint jo alaska,GetWeather,0
add this song to my list called the birth of cool,AddToPlaylist,0
what is the weather forecast close to puerto rico,GetWeather,0
put this song in my funk playlist  please,AddToPlaylist,0
add tune to electro workout,AddToPlaylist,0
will it be windy at 4 pm in ny,GetWeather,0
is it supposed to hail in rosenberg in the french polynesia,GetWeather,0
is it supposed to gt colder in or,GetWeather,0
is cape mount nature conservation unit has storm weather,GetWeather,0
tell me if it ll be chilly 1 second from now here,GetWeather,0
add the wee wee man to pamela s stress relief playlist,AddToPlaylist,0
add the avispa track to my bass gaming playlist ,AddToPlaylist,0
add tune to cleaning the house,AddToPlaylist,0
please add this song to madden nfl 16,AddToPlaylist,0
what is the weather forecast for wolin national park three seconds from now,GetWeather,0
how cold is it in princeton junction,GetWeather,0
add this artist to my jazz playlist,AddToPlaylist,0
will it get warmer in holy cross wilderness,GetWeather,0
add dahmer to hiphop hot 50,AddToPlaylist,0
add angela au to the playlist radar latino,AddToPlaylist,0
what is the forecast at four am in zambia,GetWeather,0
i want lance king in my list called one love,AddToPlaylist,0
add chris de burgh  in my playlist melancholia,AddToPlaylist,0
what is the weather at the current position,GetWeather,0
is it going to be warmer in central cebu protected landscape,GetWeather,0
add troy andrews to my pop punk powerhouses,AddToPlaylist,0
add a tune to rare groove,AddToPlaylist,0
is it going to be rainy in kings valley  kosovo next mon ,GetWeather,0
is it chilly in ecola state park at 2 pm,GetWeather,0
what s the forecast for gamaliel,GetWeather,0
add sam moran music to my tgif playlist,AddToPlaylist,0
move this tune by hironobu kageyama to my baila reggaeton playlist,AddToPlaylist,0
add billy strayhorn to my highway 61 playlist,AddToPlaylist,0
add munia the tale to my playlist called adrenaline workout,AddToPlaylist,0
will it be foggy in the same area of parc provincial kettle lakes on february the thirteenth  2018,GetWeather,0
please add checkmate to my irish folk – jigs & reels playlist,AddToPlaylist,0
what s the weather in koontz lake,GetWeather,0
add this tune to the heavy gamer playlist ,AddToPlaylist,0
is it forecast to be chilly in iowa,GetWeather,0
add mg the visionary to my dubstep playlist,AddToPlaylist,0
will there be cloud action in saint bernard  virgin islands,GetWeather,0
add connee boswell to the relaxing playlist ,AddToPlaylist,0
forecast in layhigh,GetWeather,0
add this track to my party playlist,AddToPlaylist,0
will it be chillier in suwannee,GetWeather,0
what is the weather forecast for my current position,GetWeather,0
add run rudolph run to my rockin  playlist,AddToPlaylist,0
for the playlist this is mozart add nana mizuki live fighter -blue x red side-,AddToPlaylist,0
i would like ignacio figueredo s tune added to electronow ,AddToPlaylist,0
add jason webley to classical intimate dinner playlist,AddToPlaylist,0
add album to my classical essentials playlist,AddToPlaylist,0
add teriazume to the nação reggae playlist,AddToPlaylist,0
what s the weather for this year in oregon,GetWeather,0
add the track bg knocc out to the rapcaviar playlist,AddToPlaylist,0
what s the weather looking like right now in croatia,GetWeather,0
i want to put a copy of this tune into skatepark punks,AddToPlaylist,0
add track nature noise to my playlist,AddToPlaylist,0
add steve winwood to my playlist old school metal,AddToPlaylist,0
what s the weather like in kaltag,GetWeather,0
add teddy boy to my irish folk – jigs & reels playlist,AddToPlaylist,0
is it going to be chilly at nine am in doolittle,GetWeather,0
will it be hotter netherlands antilles flats on april the 27th,GetWeather,0
what s the weather in twenty five days in hagerman national wildlife refuge,GetWeather,0
what s the weather going to be like here at ten am,GetWeather,0
will it be freezing 5 seconds from now  in patmos,GetWeather,0
will it be freezing in 5 weeks from now in nh,GetWeather,0
add nana tanimura  to a sudden rainstorm,AddToPlaylist,0
add cj snare to my indie mim playlist,AddToPlaylist,0
add already over  pt 2 to hip hop 2017 new school,AddToPlaylist,0
what is the weather like right now for fort adams,GetWeather,0
how will the weather be five weeks from now in moneta,GetWeather,0
what will the weather be like at ten am in austria,GetWeather,0
add party with friends by constructs of the state to juliana s playlist,AddToPlaylist,0
add hot house to have you met miss jones,AddToPlaylist,0
add an album to my playlist bachata lovers,AddToPlaylist,0
is it going to be cold once i get within walking distance of my home in new caledonia,GetWeather,0
tell me if it ll be freezing 333 days from now in caplinger mills  florida,GetWeather,0
add buddy tate to just dance by aftercluv list,AddToPlaylist,0
i want the turbonegro album to go on the playlist called genuine r&b,AddToPlaylist,0
will there be wind on january 24  2019 in ransom,GetWeather,0
when is sunrise in american samoa,GetWeather,0
how is the forecast for ok,GetWeather,0
add this song to brooklyn beat,AddToPlaylist,0
add htoo ein thin to my brooklyn beat playlist  ,AddToPlaylist,0
add the artist todd snider  to my electro latino playlist,AddToPlaylist,0
weather for turtle river state park,GetWeather,0
will it get windy in ocean breeze park,GetWeather,0
add this album to my forever country playlist,AddToPlaylist,0
add track to hit remix,AddToPlaylist,0
add 2120 south michigan avenue to my laundry playlist,AddToPlaylist,0
in bon secour national wildlife refuge at twelve pm will it be chilly,GetWeather,0
put hampartsoum limondjian in running to rock 170 to 190 bpm,AddToPlaylist,0
add the nastya kamenskih song to my the martin garrix show playlist ,AddToPlaylist,0
give me the forecast for here on february the sixteenth  2022,GetWeather,0
add song to my el mejor pop en español,AddToPlaylist,0
what s the weather forecast for the dominican republic,GetWeather,0
can you add honey hush to hits of the 60s,AddToPlaylist,0
add this song to my love hurts playlist,AddToPlaylist,0
add this tune to my wine & dine playlist,AddToPlaylist,0
tell me the weather forecast for carmichaels  gambia at one am,GetWeather,0
add the tune to my chill hits playlist ,AddToPlaylist,0
i want to book a restaurant in neshanic station nigeria for 06:18:13 pm,GetWeather,0
will it get hotter in hext,GetWeather,0
will it be getting warmer in rainbow falls provincial park,GetWeather,0
show fog conditions at 7 am in nh,GetWeather,0
add inconfundible to the piano in the background playlist  ,AddToPlaylist,0
what will the weather be like in 1 minute in my current position,GetWeather,0
add song in playlist metal monday,AddToPlaylist,0
add hold tight to my throwback party,AddToPlaylist,0
tell me the weather for next week at cathedral state park,GetWeather,0
what is the weather going to be like in flint hill in 9 years  ,GetWeather,0
will it be chillier in ruskin,GetWeather,0
is it forecast to be rainy in winchell  mississippi,GetWeather,0
what will the weather be in peru,GetWeather,0
show weather forecast in west wildwood south carolina,GetWeather,0
add autry inman to my hanging out and relaxing playlist ,AddToPlaylist,0
weather for south williamsport,GetWeather,0
add the track to the comedy new releases playlist ,AddToPlaylist,0
add a track to my alok house party playlist,AddToPlaylist,0
add nazad  nazad  kalino mome to escapada,AddToPlaylist,0
is it hotter now in hicks,GetWeather,0
i want cocco added to my post metal playlist  ,AddToPlaylist,0
will there be snowfall in ky,GetWeather,0
add elkie brooks to happy birthday playlist,AddToPlaylist,0
will it be cold close-by iowa on september twenty-first  2025,GetWeather,0
add this song to my classical dance music ballet & beyond list,AddToPlaylist,0
add rock & roll to my playlist named night out,AddToPlaylist,0
what s the weather like in wyandotte netherlands antilles,GetWeather,0
what is the weather forecast in va,GetWeather,0
add vyechnyy strannik to lo que suena new york,AddToPlaylist,0
what s the forecast for walker bay nature reserve for next year,GetWeather,0
add chamberlain waits to my picnic in the park,AddToPlaylist,0
the this is kevin johansen playlist needs the lamb lies down on broadway in it ,AddToPlaylist,0
add dying mapa i to más que amigos,AddToPlaylist,0
will it be warmer in ct,GetWeather,0
will the sky be overcast around jan  28 in ok,GetWeather,0
add sarah vaughan to the spa treatment playlist ,AddToPlaylist,0
add javine hylton to my evening playlist,AddToPlaylist,0
is there a snowstorm in the forecast for saint helena,GetWeather,0
love in paris needs some frank farian in the playlist  ,AddToPlaylist,0
how will the weather be in 11 years from now in the same area of florida,GetWeather,0
add the open door to autumn music,AddToPlaylist,0
add album to bajo las estrellas,AddToPlaylist,0
tell me the weather forecast 1 hour from now for town west  nevada,GetWeather,0
will it be stormy in deposit,GetWeather,0
in 1 week is there going to be a depression in washington,GetWeather,0
is it going to be cloudy in my current spot for dinner,GetWeather,0
weather in bashkirsky nature reserve 20 days from now,GetWeather,0
add bonga to the black sabbath the dio years playlist,AddToPlaylist,0
add sam sparro to my playlist called beach vibes,AddToPlaylist,0
will it be cloudy in tatamy,GetWeather,0
what s the weather in castle at 17:43,GetWeather,0
how is the humidity near my current place,GetWeather,0
what is the weather in åland 4 seconds from now,GetWeather,0
what is the weather here,GetWeather,0
add yoshiki to the 35 soul classics 1970 to 1975 playlist,AddToPlaylist,0
is there going to be any cloud cover today at mccracken in az,GetWeather,0
add vl mike to my dcode2016 playlist,AddToPlaylist,0
what is the weather of sri lanka,GetWeather,0
what will be the wind speed at the current place,GetWeather,0
put michael cretu onto my beach vibes playlist,AddToPlaylist,0
add this artist to metal party,AddToPlaylist,0
what is the weather forecast for åland,GetWeather,0
add paloma negra to my funky jams list,AddToPlaylist,0
add some martine mccutcheon to my original columbia jazzmasters list,AddToPlaylist,0
how is weather here,GetWeather,0
add tune to my is it new wave,AddToPlaylist,0
what is the weather forecast for sunset in bouvet island,GetWeather,0
add another album to my this is pavarotti playlist  ,AddToPlaylist,0
play used to love her to my this is animal collective playlist,AddToPlaylist,0
add fair charlotte to the we everywhere playlist ,AddToPlaylist,0
will it be chilly 17 hours from now in cold creek conservation area,GetWeather,0
will it be overcast at 18 o clock in id,GetWeather,0
add sara hickman to my targeted list,AddToPlaylist,0
is it chillier at narew national park,GetWeather,0
tell me if it ll be temperate three hours from now in bonaire,GetWeather,0
what is the forecast in kearneysville,GetWeather,0
what s the weather look like for mh,GetWeather,0
i want to add the classical moments in movies track to my playlist,AddToPlaylist,0
add to my verano list a song by andy lee,AddToPlaylist,0
will it get foggy in spring hill,GetWeather,0
is the weather going to be colder in gu in 11 years ,GetWeather,0
tell me if it ll blizzard in ks,GetWeather,0
is the forecast windy now in fort myers shores arizona,GetWeather,0
edit top 100 indie tracks on spotify playlist by adding smokefree rockquest 2005,AddToPlaylist,0
put edwyn collins onto my trabajo relax playlist,AddToPlaylist,0
will it get chillier here,GetWeather,0
put this album on my wine & dine playlist,AddToPlaylist,0
check the forecast for keene ,GetWeather,0
weather for july 1 in ut,GetWeather,0
what will be the humidity 5 years from now  in bradbury mountain state park,GetWeather,0
add the track to the best metal of the new millennium playlist ,AddToPlaylist,0
is it supposed to get chilly in dewey,GetWeather,0
want to add pacific ocean blues to the playlist named lunch,AddToPlaylist,0
is it going to be sunny at 21 o clock close-by district of columbia,GetWeather,0
is there a depression in weather at my current spot,GetWeather,0
what s the weather forecast for my current location on jun  2,GetWeather,0
what s the forecast for little silver,GetWeather,0
is it hot in bolivia,GetWeather,0
add artist danny carey to my classic jazz singers playlist  ,AddToPlaylist,0
add this album to my just dance by aftercluv playlist,AddToPlaylist,0
is it freezing in tira,GetWeather,0
what s the weather on bird island burkina at shavuot,GetWeather,0
what s the weather forecast for elida  rhode island,GetWeather,0
add this song to my roadrunner rec new releases list ,AddToPlaylist,0
add this track by clem burke to my atmospheric black metal playlist,AddToPlaylist,0
add a song to my playlist a peaceful rush hour,AddToPlaylist,0
add family tree to conexiones,AddToPlaylist,0
add mr j medeiros to my women of country playlist ,AddToPlaylist,0
add this album by bruce dickinson onto top entrevistas my playlist,AddToPlaylist,0
add this artist to my guilty pleasures playlist,AddToPlaylist,0
add a tune to my elrow guest list,AddToPlaylist,0
please put live with me onto my playlist named carácter latino,AddToPlaylist,0
will it be colder in tallgrass prairie national preserve,GetWeather,0
what s the weather like at sunset hills,GetWeather,0
add song to top 100 country tracks on spotify ,AddToPlaylist,0
add a kiley dean tune to my jazz for loving couples playlist ,AddToPlaylist,0
is it foggy in shelter island,GetWeather,0
add the name covenant to the playlist fusion fest,AddToPlaylist,0
whats the weather in irma,GetWeather,0
tell me if it ll be temperate in 8 seconds in guatemala,GetWeather,0
will it be windy in breaux bridge  turks and caicos islands eleven hours from now,GetWeather,0
what was the weather like last may at altai tavan bogd national park,GetWeather,0
add album to mellow bars,AddToPlaylist,0
is it going to be sunny at five pm in chatyrkul wildlife refuge,GetWeather,0
will it get chillier in 12 years  in greenland,GetWeather,0
forecast for guatemala,GetWeather,0
will it be sunny in spain on 3/26/2023,GetWeather,0
add tune digster reggae,AddToPlaylist,0
add magnifico to michele s playlist called 88 keys ,AddToPlaylist,0
will there be a storm on christmas day in my current place,GetWeather,0
please let me know the weather forecast in louisiana state,GetWeather,0
add curse song to my playlist guest list engadget,AddToPlaylist,0
is it supposed to be chilly in de tonight,GetWeather,0
what s the weather far away in estonia,GetWeather,0
add ik tara to laundry playlst,AddToPlaylist,0
put do you love me on my acoustic soul playlist,AddToPlaylist,0
will it be rainy at 8 in dans mountain state park,GetWeather,0
add welcome to the cruel world to my reggae classics,AddToPlaylist,0
add bronislau kaper to the drive playlist ,AddToPlaylist,0
can you get the weather forecast for new baden ,GetWeather,0
add name me & the rhythm to my chill out music,AddToPlaylist,0
what s the weather forecast for coats,GetWeather,0
add heart like a hurricane to digster soul classics,AddToPlaylist,0
add artist to my phunkadelic playlist,AddToPlaylist,0
put paula abdul on musica española 2017,AddToPlaylist,0
put this album on my conexiones list ,AddToPlaylist,0
tell me the weather forecast for northern mariana islands one second from now,GetWeather,0
will it get cold in nevada seven weeks and a half from now,GetWeather,0
can you add something by gregori chad petree to the playlist digster soul classics,AddToPlaylist,0
please add a song to ines s playlist called metal party,AddToPlaylist,0
is there going to be snowfall in alton,GetWeather,0
add hallucinations of despair to my this is trey songz playlist ,AddToPlaylist,0
please put this track onto letha s signed xoxo playlist,AddToPlaylist,0
will it be snowy in florewood state park,GetWeather,0
is it forecast to be chillier around texas,GetWeather,0
add the artist to my 31 minutos playlist,AddToPlaylist,0
what will the weather be like 1 second from now in pugu hills forest reserve,GetWeather,0
add kaya newest track to my i love my  00 s r&b playlist,AddToPlaylist,0
what will the weather be within the same area in minnesota on june 27th  2023,GetWeather,0
what is the weather at my current location,GetWeather,0
i want to put roberto valverde into my ultra metal list,AddToPlaylist,0
what is the forecast for tschetter colony on ascension day in oregon,GetWeather,0
add this tune by shagrath to black sabbath the ozzy years,AddToPlaylist,0
add halley to this is tchaikovsky ,AddToPlaylist,0
what s the weather forecast for east berlin  al,GetWeather,0
put joseph utsler on all out 70s,AddToPlaylist,0
what s the weather forecast for new zealand,GetWeather,0
add this artist named cleopatra stratan to my playlist named 30 before 20 masterworks by teenagers,AddToPlaylist,0
add joan wasser to running playlist,AddToPlaylist,0
show freezing forcast now within the same area in north dakota,GetWeather,0
add i pledge allegiance to the grind to my sinfonía hipster playlist,AddToPlaylist,0
will it get hotter in the city of ashford,GetWeather,0
warren island state park distant weather forecast for 11 am,GetWeather,0
can you add something by the artist paul cargnello to my chill tracks playlist,AddToPlaylist,0
add falling stars to my intense studying,AddToPlaylist,0
tell me the weather forecast one year from now in kulpsville  togo,GetWeather,0
put framed onto my ntc studio sounds playlist,AddToPlaylist,0
can you add something from method man to my this is mozart playlist ,AddToPlaylist,0
add song to daily lift playlist,AddToPlaylist,0
will it get colder in cape fair,GetWeather,0
will it get chilly 1 minute from now in carterville,GetWeather,0
add this tune by frankie laine to my playlist kitchen swagger,AddToPlaylist,0
put before the eulogy onto acoustic blues,AddToPlaylist,0
put the airi suzuki album into my nuclear blast novelties playlist,AddToPlaylist,0
add as i was going to st ives to the fantasía playlist  ,AddToPlaylist,0
