text,labels,is_ood
add this track to the playlist korean osts,AddToPlaylist,0
what s the weather faraway from here on sep  the fifteenth,GetWeather,0
add my old kentucky home to fresh finds fire emoji,AddToPlaylist,0
will it be chillier in uruguay in 213 days,GetWeather,0
add anthony hamilton to my list women of hip hop,AddToPlaylist,0
i want to add robin hood and queen katherine to my playlist entitled genuine r&b,AddToPlaylist,0
what s the temperature today in griffin  ne,GetWeather,0
will it rain on sep  25th in east tawakoni,GetWeather,0
what s the weather forecast for belknap,GetWeather,0
what is the weather like in hebbronville venezuela,GetWeather,0
add song to orgánica,AddToPlaylist,0
add nina hagen to essential folk,AddToPlaylist,0
what is the weather going to be at dinner time in the lake le-aqua-na state recreation area,GetWeather,0
will there be rainfall the day after tomorrow far from rodna national park ,GetWeather,0
add this tune to the duetos playlist,AddToPlaylist,0
add jonny buckland to my playlist weekly buzz,AddToPlaylist,0
weather for my current location tomorrow,GetWeather,0
what is the weather in nd the city of evangeline,GetWeather,0
will it be hotter in pecan grove,GetWeather,0
what will the weather be in a month from now at my current location,GetWeather,0
add nitti to my family favorites playlist,AddToPlaylist,0
add this annabella lwin track to indie alternativa,AddToPlaylist,0
add this artist to lo más dance playlist ,AddToPlaylist,0
how will the weather be on may 9 in wyoming,GetWeather,0
what s the weather close-by triumph,GetWeather,0
put the artist michael todd in my afternoon train ride list,AddToPlaylist,0
is the weather temperate in millinocket,GetWeather,0
add this song to my cleaning the house playlist,AddToPlaylist,0
will it get hotter in zenith ct,GetWeather,0
add a bill deasy track to the conexiones playlist  ,AddToPlaylist,0
add song to my club hits,AddToPlaylist,0
i would like this artist on drum & breaks ,AddToPlaylist,0
what s the weather like in saint regis falls nd,GetWeather,0
what is the forecast for january twenty-eighth in kentmore park,GetWeather,0
what is the current position forecast for starting on july 22,GetWeather,0
add joey fatone to my spotlight on country 2016 playlist,AddToPlaylist,0
what is the forecast for bonner starting oct  24th  2025 for argentina,GetWeather,0
can the artist big mama thornton be put onto my trabajo relax playlist,AddToPlaylist,0
what is the colder forecast for nationaal park bidoup núi bà in a week ,GetWeather,0
tell me when it ll be sunny in ralls  marshall islands,GetWeather,0
edit classic road trip songs put on sammy cahn,AddToPlaylist,0
add dave carpenter to my acoustic blues playlist,AddToPlaylist,0
what is the forecast in wild river state park,GetWeather,0
add tune to my instrumental funk playlist,AddToPlaylist,0
what s the weather this month in mozambique,GetWeather,0
what s the weather in mountain center,GetWeather,0
add the 3rd world to my focus now,AddToPlaylist,0
can you put dj kay slay onto the 2010 decade playlist,AddToPlaylist,0
what will the weather be like in 16 weeks at the ivory coast,GetWeather,0
is there a storm in maliau-basin-conservation-area now,GetWeather,0
is it going to be warmer in cinnaminson  north carolina at 06:59 am,GetWeather,0
what s the weather like in el salvador on wed ,GetWeather,0
how s the weather looking in pheba,GetWeather,0
is it snowy in demotte ms,GetWeather,0
what will the weather be like on september the eighteenth in puerto rico,GetWeather,0
add tune to soft rock playlist,AddToPlaylist,0
add another song to the country playlist  ,AddToPlaylist,0
add beverley knight to my mellow beats playlist,AddToPlaylist,0
how will the weather be at 9 am in anguilla,GetWeather,0
what will the weather be in umatilla malta,GetWeather,0
add bedroom jams to album,AddToPlaylist,0
in seven hours from now will it rain at my current place,GetWeather,0
tell me if it ll be freezing here in 21 seconds,GetWeather,0
what is the gearhart forecast,GetWeather,0
add some fujimoto yae to my women of rock list,AddToPlaylist,0
will it be snowy in crouch  french polynesia,GetWeather,0
is it hot in neighboring algeria,GetWeather,0
what is the weather forecast for here,GetWeather,0
please add this album to the playlist titled hip hop 2017 new school,AddToPlaylist,0
put sungmin into my summer playlist,AddToPlaylist,0
put dj green lantern on my targeted playlist,AddToPlaylist,0
what is the forecast for around putnam lake,GetWeather,0
what is the weather in twenty three minutes in nv,GetWeather,0
will weather conditions be stormy here from 6/15/2025 onward ,GetWeather,0
please check the weather forecast here ,GetWeather,0
will there be a depression here on october 26,GetWeather,0
how is the weather in oh,GetWeather,0
what is the british virgin islands forecast for next november,GetWeather,0
add a randy travis song to deep dark indie folk,AddToPlaylist,0
what is the forecast for march the twelfth faraway from pine mountain state resort park,GetWeather,0
is it snowy in ocean shores,GetWeather,0
do you know if it will be chilly today in puerto rico,GetWeather,0
add tune to my folk music at the gaslight café,AddToPlaylist,0
weather on september 14 in crofton ukraine,GetWeather,0
add tune to women of pop playlist,AddToPlaylist,0
include jesper kyd in the grime instrumentals playlist ,AddToPlaylist,0
how cold will it be in palau around fourteen o clock,GetWeather,0
add annette artani to the playlist titled all out 90s,AddToPlaylist,0
add genocide to electronic bliss,AddToPlaylist,0
put this song on my indiespensables playlist,AddToPlaylist,0
add this song to noreen s fresh finds six strings,AddToPlaylist,0
add elastic love to this is stormzy,AddToPlaylist,0
can you give me the forecast for keytesville for 12 minutes from now,GetWeather,0
what is the forecast for orienta for hotter weather,GetWeather,0
what will the weathr be in akin jamaica,GetWeather,0
what will the weather be like in the bahamas eleven years and a half from now,GetWeather,0
add embryo to lessie s hands up,AddToPlaylist,0
add this tune to my playlist guest list mashable,AddToPlaylist,0
what is the depression forecast for in five years  in altyn-emel-nationalpark,GetWeather,0
add undressed to my country icon playlist,AddToPlaylist,0
what will it feel like in the current place in july,GetWeather,0
put kan on my indie rock road trip,AddToPlaylist,0
add hello  my lover  goodbye to my deathcore playlist,AddToPlaylist,0
add a mina caputo album to my after hours party ,AddToPlaylist,0
add monsters this is prince playlist,AddToPlaylist,0
is there a snowstorm coming in dana at 4 pm,GetWeather,0
what will the weather be like in nickelsville,GetWeather,0
is it temperate in the current location now,GetWeather,0
what s the weather forecast for pointe-heath ecological reserve at midnight,GetWeather,0
add tune to nusic,AddToPlaylist,0
add etta james to my anochecer urbano playlist  ,AddToPlaylist,0
will it be warmer in amnicon falls state park,GetWeather,0
what s the weather forecast for mansfield,GetWeather,0
is it colder in paraguay this morning,GetWeather,0
add amir khan to my playlist acoustic blues,AddToPlaylist,0
add all together now to my playlist the road to punk rock ,AddToPlaylist,0
is it going to be hot in chrisman,GetWeather,0
wuill it be cloudy in dickson city illinois,GetWeather,0
put this song on my ntc high intensity training tracks playlist,AddToPlaylist,0
add artist to showstopper being mary jane,AddToPlaylist,0
add this track to krystal s piano 100,AddToPlaylist,0
add the fire and the wind to my digster future hits playlist ,AddToPlaylist,0
add a song to my playlist independent music monday,AddToPlaylist,0
how will the weather be this summer in new york,GetWeather,0
what s the weather forecast for next week at my current position,GetWeather,0
what is the forcast now in kansas,GetWeather,0
add glory in the highest a christmas record in my playlist cleaning,AddToPlaylist,0
add this track to my gold school playlist,AddToPlaylist,0
what is the forecast for here at 8 am,GetWeather,0
add this track to my love hurts playlist,AddToPlaylist,0
what is the forecasted humidity in ghana for epiphany,GetWeather,0
whats the forecast for redby,GetWeather,0
shawn lane should be moved to my cena con amigos playlist,AddToPlaylist,0
add agua y sal in classic jazz funk,AddToPlaylist,0
put the orange and the green on los 40 radio éxitos,AddToPlaylist,0
is it overcast in ziwa rhino sanctuary,GetWeather,0
can you add john scofield newest tune the selektor  to the playlist,AddToPlaylist,0
i want more francis healy in the rockin  vibes playlist  ,AddToPlaylist,0
is it forecast to be temperate here,GetWeather,0
is it overcast close-by in illinois,GetWeather,0
what is the forecast on 12/9/2039 at florida caverns state park,GetWeather,0
add a jang nara track to the hip hop gaming playlist  ,AddToPlaylist,0
what s the weather going to be like in a week at big walnut creek nature preserve,GetWeather,0
add robert nighthawk to novedades pop,AddToPlaylist,0
will it be freezing in new ringgold nebraska,GetWeather,0
what s the weather forecast for connecticut,GetWeather,0
tell me if it ll be freezing in 5 years  in rockholds  norfolk island,GetWeather,0
add reggaeton classics in playlist jennie  jennie,AddToPlaylist,0
is the expected weather temperate here in 1 month,GetWeather,0
add paula abdul to classic acoustic playlist,AddToPlaylist,0
add this infernus tune do marsha s de camino a clase,AddToPlaylist,0
is it cold in windhorst,GetWeather,0
add artist matt noveskey to journey,AddToPlaylist,0
will it be hot in the cayman islands on november 12th  2035,GetWeather,0
what is the weather in port vue,GetWeather,0
what is the forecast for farmerville in cape verde,GetWeather,0
add current album to my pop gaming playlist,AddToPlaylist,0
add this piece to my spotify orchestra cello playlist: colors of the wind,AddToPlaylist,0
what s the weather forecast in nationalpark banc d’arguin,GetWeather,0
tell me if there will be hail at tea time in nordland,GetWeather,0
add naseer shamma to piano chill,AddToPlaylist,0
what s the weather in niagara,GetWeather,0
is it warm at seven am in greenland,GetWeather,0
what is the weather now in james city,GetWeather,0
add the album to the metalcore playlist,AddToPlaylist,0
what is the weather in steward,GetWeather,0
put sarah blasko onto my the metalsucks playlist ,AddToPlaylist,0
add this artist to reggae classics playlist,AddToPlaylist,0
what is the forecast for this current position for chilly temps,GetWeather,0
add the artist leann rimes to the women of indie playlist  ,AddToPlaylist,0
will it snow in haigler bosnia and herzegovina,GetWeather,0
incorporate nao kawakita into the epic classical playlist  ,AddToPlaylist,0
add this artist to sunshine reggae ,AddToPlaylist,0
forecast for vi ,GetWeather,0
what will the weather be in palm bay pa,GetWeather,0
add an album in my playlist in the name of blues,AddToPlaylist,0
is there a lot of sun in qatar,GetWeather,0
add the private collection onto my cena elegante playlist please ,AddToPlaylist,0
add this artist to my this is miguel bosé playlist,AddToPlaylist,0
add artist leonard cohen to my indie brazuca,AddToPlaylist,0
put conway twitty in the this is tchaikovsky playlist  ,AddToPlaylist,0
show cold weather forecast in five hours and 1 minute in hokendauqua  mongolia,GetWeather,0
add a tune to the calm vibes playlist ,AddToPlaylist,0
is the sun coming out today in lacassine national wildlife refuge,GetWeather,0
is it forecast to be hot in greenland this winter,GetWeather,0
input this album onto my all things post list,AddToPlaylist,0
is it freezing close to dc,GetWeather,0
add artist to acoustic soul,AddToPlaylist,0
what s the forecast for my current spot,GetWeather,0
what is the weather forecast in 11 seconds for frederick douglass national historic site,GetWeather,0
is it warm in vietnam,GetWeather,0
weather in nationalpark nevado tres cruces on mar  4th  2020,GetWeather,0
what is the weather forecast for maryland,GetWeather,0
weather for burr,GetWeather,0
add tune to this is trey songz,AddToPlaylist,0
add without your love to my showstopper being mary jane list,AddToPlaylist,0
will there be a lot of wind in west fargo gu,GetWeather,0
what is forecast in keyes summit in new mexico at 3 pm,GetWeather,0
add however much i booze to my playlist called atmospheric black metal,AddToPlaylist,0
i want lay down your arms in the indie español playlist  ,AddToPlaylist,0
add jalal zolfonun to my nature noise,AddToPlaylist,0
tell me if it will hail in kyrgyzstan,GetWeather,0
add the trey gunn tune to my french n  heavy playlist ,AddToPlaylist,0
add track to fresh finds,AddToPlaylist,0
what s the weather in paulette yemen,GetWeather,0
tell me the weather forecast for my current spot 1 minute from now,GetWeather,0
will it be warm in the current place next spring,GetWeather,0
will it be rainy in malta,GetWeather,0
add heat of the night to my novedades viernes sudamérica playlist,AddToPlaylist,0
hows the weather supposed to be on april eleventh close by lyons ferry park,GetWeather,0
will there be a blizzard in chapel point state park or in the same area,GetWeather,0
add this album to my us latin top 50 palylist,AddToPlaylist,0
can you add something by vikki thorn to my lo mejor de los 80 s playlist,AddToPlaylist,0
is it supposed to get colder here on 12/28/2019,GetWeather,0
add the tune to the indie workout playlist,AddToPlaylist,0
add a bum note and a bead of sweat to my stress relief playlist,AddToPlaylist,0
estelle should be on my spring playlist,AddToPlaylist,0
is it nice in pw,GetWeather,0
add el noi de la mare to the new waltz playlist,AddToPlaylist,0
will be warm in hallwood  kosovo,GetWeather,0
please include emily remler in indie bluegrass,AddToPlaylist,0
add the “chirping” crickets to my mellowed out gaming playlist,AddToPlaylist,0
can you tell me what the weather is doing in north epworth  guam,GetWeather,0
will it be warm at mountainair,GetWeather,0
tell me the current forecast for switzerland,GetWeather,0
add alexandra govere to my anochecer urbano playlist,AddToPlaylist,0
what will the weather be in angle cape verde at midnight,GetWeather,0
what s the weather forecast for here on jul  23,GetWeather,0
add bright and breezy to my this is gucci mane playlist,AddToPlaylist,0
what is the cold forecast for our current position,GetWeather,0
add welcome to the cruel world to my reggae classics playlist,AddToPlaylist,0
add gary valenciano to the power gaming playlist  ,AddToPlaylist,0
show weather forecast in kenya,GetWeather,0
how hot will be there in kanwar lake bird sanctuary tomorrow,GetWeather,0
put this kan mikami tune on fresh finds cyclone,AddToPlaylist,0
please add a tune by kaori utatsuki to my korean osts playlist,AddToPlaylist,0
add kisaki to family road trip playlist,AddToPlaylist,0
add toi to my timeless love songs playlist,AddToPlaylist,0
tell me the weather forecast thirteen seconds from now in ukraine,GetWeather,0
add the go find to sólo para dos,AddToPlaylist,0
will it hail in 1 second on riceboro delaware,GetWeather,0
add a track in nike running tempo mix,AddToPlaylist,0
is it windy in custar,GetWeather,0
tell me when it will be warmer in woods hole  oklahoma,GetWeather,0
add días felices to my todo reggaeton playlist,AddToPlaylist,0
what will the weather be in mascoutah  tanzania at 09:04:38 am,GetWeather,0
will the weather be colder in naguabo four minutes from now,GetWeather,0
how hot is it in pesotum,GetWeather,0
put this whole album on the playlist called old school metal,AddToPlaylist,0
can you give me weather details for my current spot,GetWeather,0
what will the weather be like in three weeks in gates michigan,GetWeather,0
add to laundry playlist with this song,AddToPlaylist,0
what will the weather be like in twenty two minutes at san pasqual battlefield state historic park,GetWeather,0
add maggie mcgill to my night vibes,AddToPlaylist,0
add to my playlist heavy gamer the name blaydon races,AddToPlaylist,0
add guy warren to my bossa nova dinner playlist  ,AddToPlaylist,0
add this rob campanella tune to psychedelic rock,AddToPlaylist,0
what will the weather be like at me current position in seventeen seconds,GetWeather,0
what s the weather in heritage hill state historical park,GetWeather,0
is it better in holi or here,GetWeather,0
what is the weather in gem,GetWeather,0
add this track to downtempo beats,AddToPlaylist,0
add vintage 74 to my mother s  primavera sound 2016 barcelona playlist,AddToPlaylist,0
i want another song in the women of latin music playlist  ,AddToPlaylist,0
add quicksand to my valentine s day love playlist,AddToPlaylist,0
need a table now somewhere nearby petit manan national wildlife refuge,GetWeather,0
add this artist to my playlist named funtime,AddToPlaylist,0
add this artist to dubstep,AddToPlaylist,0
what s the weather in parthenon,GetWeather,0
add jarvis cocker to my chillin  on a dirt road playlist,AddToPlaylist,0
add spanish castle magic to daily lift,AddToPlaylist,0
add this artist to spain top 50,AddToPlaylist,0
what is the forecast for papua new guinea for lunch for rainfall,GetWeather,0
put some mac wiseman in my latino caliente playlist  ,AddToPlaylist,0
what s the weather in waretown lebanon,GetWeather,0
can you make an addition to the old enough to enjoy this playlist with martin barre,AddToPlaylist,0
add tracy chapman to late night jazz,AddToPlaylist,0
add the spine surfs alone to my playlist called the funny thing about football is,AddToPlaylist,0
will there be s snowstorm at my current location this week,GetWeather,0
add yuna ito to my cena elegante playlist,AddToPlaylist,0
check the forecast for orson for around 9 pm,GetWeather,0
add potje met vet to my electronic gaming playlis,AddToPlaylist,0
add antisleep volume 04 in all out 70s playlist,AddToPlaylist,0
add keltech to my 70s road trip playlist,AddToPlaylist,0
add this song to the pre-party playlist,AddToPlaylist,0
what will the weather be in romania at 4,GetWeather,0
what kind of weather was forecast near harmony flats nature reserve last march ,GetWeather,0
please add john deacon to the funtime activity playlist,AddToPlaylist,0
add this song to my metal playlist,AddToPlaylist,0
is it forecast to be stormy close to nimule-nationalpark 1 hour from now,GetWeather,0
tell me if it ll be overcast nearby papua new guinea,GetWeather,0
what will the weather be like in the falkland islands starting may 25  2022,GetWeather,0
what is the sri lanka forecast for snow,GetWeather,0
i want to add a song by w c clark to my nerding around playlist,AddToPlaylist,0
what s the weather in oregon,GetWeather,0
what is the weather in neighboring oh,GetWeather,0
what will it be like in the current place at midnight,GetWeather,0
add rattus at the roundhouse to my funk playlist ,AddToPlaylist,0
add song to my mellow beats list,AddToPlaylist,0
add adam yauch to my spooning,AddToPlaylist,0
weather for nearby roselle,GetWeather,0
the dubstep dangles dirty playlist needs digital at montreux in it,AddToPlaylist,0
add so far to my retrovisor playlist  ,AddToPlaylist,0
what kind of weather will be in va 12 years from now,GetWeather,0
add sirusho to the 50 clásicos playlist,AddToPlaylist,0
add this alan wilson track to my this is luis fonsi playlist,AddToPlaylist,0
will it be warm in cotati in guinea-bissau,GetWeather,0
what is the forecast for sanibel,GetWeather,0
add el pavo dustin to viajes,AddToPlaylist,0
put four in blue onto ultimate 00s ,AddToPlaylist,0
put jazzy b on lazy chill afternoon playlist,AddToPlaylist,0
what s the weather forecast for sweden on oct  the fifth,GetWeather,0
will it be colder this saturday in nc,GetWeather,0
will it be colder 1 minute from now in jersey,GetWeather,0
what is the weather forecast for laos,GetWeather,0
add track to all out 70s,AddToPlaylist,0
tell me the weather forecast faraway from tx,GetWeather,0
what is the weather in arkansas the city of morrison,GetWeather,0
will it be hot during winter,GetWeather,0
weather for oct  16 in mo,GetWeather,0
add salil chowdhury to my 35 soul classics 1970 to 1975 playlsit,AddToPlaylist,0
weather for six am in sc,GetWeather,0
what will the weather be in fl on 1/11/2030,GetWeather,0
will it still be warm nineteen hours from now in pa,GetWeather,0
i want you to add a george chisholm tune to my 40 hits playlist  ,AddToPlaylist,0
add album to feeling blue,AddToPlaylist,0
tell me if it ll be colder next november in granite-steppe lands of buh,GetWeather,0
add dan the automator to forever country,AddToPlaylist,0
add all bad to the summer of love playlist  ,AddToPlaylist,0
put mike mccready in the kitchen swagger playlist  ,AddToPlaylist,0
add ray noble to my chill vibes playlist ,AddToPlaylist,0
add this tetsuya komuro track to my soulful disco playlist,AddToPlaylist,0
add little musgrave and the lady barnard to ora s punk rock workout playlist,AddToPlaylist,0
is it going to be warm here for brunch,GetWeather,0
what s the forecast for mt next week,GetWeather,0
will it hail in 1 minute in toms river,GetWeather,0
add this song to clarice s latino caliente playlist,AddToPlaylist,0
what s the weather forecast for delaware right now,GetWeather,0
forecast for laguna heights barbados,GetWeather,0
what is the forecast for 8/26/2022 in vermont,GetWeather,0
i need to know what the weather will be like in gradyville at breakfast  in the state of colorado ,GetWeather,0
is it sunny in qatar,GetWeather,0
what is the weather forecast for east cleveland  republic of the congo,GetWeather,0
add track by klute to winifred s de camino a clase playlist,AddToPlaylist,0
can you put this xandee song onto my chill playlist,AddToPlaylist,0
will it be rainy faraway in charleston lake provincial park in 13 hours,GetWeather,0
add the name not fade away to the playlist the midnight hour,AddToPlaylist,0
add this album to digster future hits,AddToPlaylist,0
add the time warp to wild & free workout,AddToPlaylist,0
will it be rainy nine weeks from now close to the matlacha pass national wildlife refuge,GetWeather,0
payette national forest is cold weather and have lunch within walking distance,GetWeather,0
is there going to be a depression in my current location on nov  the ninth,GetWeather,0
check the forecast for zena  arkansas on last day of passover ,GetWeather,0
will it be stormy in saint pierre and miquelon in the city of wenham,GetWeather,0
is it going to be chilly here,GetWeather,0
i want to put sons of the sea on the pulse of americana playlist,AddToPlaylist,0
add shelby lynne to my playlist this is luis fonsi,AddToPlaylist,0
add a song to the para dormir playlist ,AddToPlaylist,0
add georgetown university alma mater to my evening acoustic playlist,AddToPlaylist,0
tell me if it ll be freezing next month in rhode island,GetWeather,0
is the forecast windy in nigeria on nov  the 6th,GetWeather,0
i need the weather in muncie,GetWeather,0
what will the weather be in croatia,GetWeather,0
what is the weather like now in washington,GetWeather,0
what s the weather in ri,GetWeather,0
what is the forecast for my current place at 23 o clock,GetWeather,0
add an album to my week end playlist,AddToPlaylist,0
tell me the forecast in the same area here on robert e lee s birthday,GetWeather,0
will it be colder in winnebago,GetWeather,0
add showcase in a suitcase to the chill out playlist  ,AddToPlaylist,0
what will the weather be like in fourteen hours in eastville,GetWeather,0
will it snow in my current location,GetWeather,0
will it be overcast in my current location at twelve pm ,GetWeather,0
what will the weather be in four weeks around tsingy de bemaraha strict nature reserve,GetWeather,0
add let the season in  to my  lo-fi love,AddToPlaylist,0
is it windy in june park,GetWeather,0
i need to know the weather for san martin,GetWeather,0
add kd lang to my deep focus playlist,AddToPlaylist,0
what is the october 19th forecast for iran,GetWeather,0
what s the weather in mettawa oklahoma,GetWeather,0
add flying to my women of rock playlist,AddToPlaylist,0
will there be fog tonight at beamer memorial conservation area,GetWeather,0
tell me if it will be hot on jun  the 10th in san de fuca  sweden,GetWeather,0
add rev-raptor to 90s indie,AddToPlaylist,0
add ghost on the dance floor to my autumn lounge playlist,AddToPlaylist,0
weather for afghanistan in one minute ,GetWeather,0
what is the weather forecast tomorrow in french  ut,GetWeather,0
add thomas a dorsey to my big band,AddToPlaylist,0
i need another artist in the romántica playlist  ,AddToPlaylist,0
will it be chilly in milligan college  ak on law day,GetWeather,0
is there a chance of hail in holiday hills,GetWeather,0
add my very best to my road trip playlist  ,AddToPlaylist,0
is it going to be warm in cottageville,GetWeather,0
add the yumi matsuzawa album to my sexy as folk playlist,AddToPlaylist,0
add sveta ljubav to my metal party playlist,AddToPlaylist,0
what s the forecast for il around tea time ,GetWeather,0
add bulat schalwowitsch okudschawa to retro pop,AddToPlaylist,0
i d like to put ryō yamazaki onto my sylvia plath playlist ,AddToPlaylist,0
will it snowstorm neighboring the rio grande wild and scenic river on feb  the second,GetWeather,0
please let me know the weather forecast in louisiana state,GetWeather,0
put this artist in pachangueo total,AddToPlaylist,0
for my té para tres list add cut the world,AddToPlaylist,0
what is the weather forecast 131 days from now in atanassow-see,GetWeather,0
add this song to my playlist named britpop  etc,AddToPlaylist,0
add the song by brian larsen to the cardio playlist,AddToPlaylist,0
will it be stormy in charleston,GetWeather,0
what s the forecast for sai thong national park at 02:59 pm,GetWeather,0
add track 70s smash hits to my,AddToPlaylist,0
put kurt cobain onto korean osts ,AddToPlaylist,0
is it cold in pw,GetWeather,0
i need a weather forecast for laos at one am,GetWeather,0
add a song by  mark schultz to my ultimate indie playlist,AddToPlaylist,0
