text,labels,is_ood
will the sun be out close-by admiralty island national monument,GetWeather,0
add track to my cloud rap,AddToPlaylist,0
i want a mi lu bing song in my pop dance playlist  ,AddToPlaylist,0
put new page onto my latin jazz playlist ,AddToPlaylist,0
add joelia savitsjeva in 88 keys,AddToPlaylist,0
can you add some morton feldman piano and string quartet to my global funk playlist,AddToPlaylist,0
how is the weather far from my current place in 42 weeks,GetWeather,0
what is the 10 pm forecast for sweet springs wyoming,GetWeather,0
what will the eather be here next year,GetWeather,0
what will the weather be like in samoa at 6 pm,GetWeather,0
weather at bystrzyca valley landscape park,GetWeather,0
will it be cold in chatmoss albania 8 years and a half from now,GetWeather,0
what s the weather in the u s  virgin islands,GetWeather,0
what is the tal chhapar sanctuary forecast for cold weather,GetWeather,0
add dave bickler to my all out 90s playlist,AddToPlaylist,0
add what child is this to dark dance floors,AddToPlaylist,0
put this album in my fiesta section,AddToPlaylist,0
my disco forever playlist needs an album by sawai gandharva ,AddToPlaylist,0
add the happy elf to my fresh finds fire emoji playlist,AddToPlaylist,0
add this artist to cynthia s fresh finds,AddToPlaylist,0
is it chillier in baconton ky,GetWeather,0
how will the weather be in new mexico around 00:09:07 am,GetWeather,0
put this artist onto political punks ,AddToPlaylist,0
add histoires sans paroles to my women of k-pop list,AddToPlaylist,0
add stephen mcnally to confidence boost,AddToPlaylist,0
add this tune to my dance playlist,AddToPlaylist,0
what s the weather in blackman jordan,GetWeather,0
add this song to year in metal 2016,AddToPlaylist,0
will it be cloudy not far  from allenton,GetWeather,0
what is the jan  8 forecast for here,GetWeather,0
add an album by m g sreekumar to my laidback acoustic playlist ,AddToPlaylist,0
add ronnie james dio tune to women of electronic selection,AddToPlaylist,0
put this tune on all a cappella,AddToPlaylist,0
what will the weather be at ten am in fourche  nv,GetWeather,0
add one and only to my once upon a time playlist,AddToPlaylist,0
is there a cloud in the sky in thornville on feb  fifth,GetWeather,0
what s it feel like in north gulfport,GetWeather,0
add shawn camp to my soulful disco playlist  ,AddToPlaylist,0
what s the weather forecast for winnfield  georgia,GetWeather,0
what s the weather forecast in humphrey,GetWeather,0
forecast for 02:22 pm maldives,GetWeather,0
add diarios de bicicleta to my la la playlist,AddToPlaylist,0
can you tell me what the weather is like at sam d  hamilton noxubee national wildlife refuge,GetWeather,0
add 21 at 33 to the playlist called wake up everybody,AddToPlaylist,0
what s the weather like in mountainair,GetWeather,0
what is the wauseon forecast,GetWeather,0
tell me the weather forecast for roseburg  iowa,GetWeather,0
is it warm in vallecito,GetWeather,0
what is going on with the weather far from my current location,GetWeather,0
add this tune to my fresh finds hiptronix playlist ,AddToPlaylist,0
will be it cloudy close by azerbaijan in 55 weeks ,GetWeather,0
is it going to be warm here,GetWeather,0
add tarkan to my madrugando playlist,AddToPlaylist,0
forecast for 11 am in nauru,GetWeather,0
will there be a blizzard next friday close in tn,GetWeather,0
add the album to rosanna s ejercicio playlist ,AddToPlaylist,0
please put the artist matt mckenna in my this is shakira playlist,AddToPlaylist,0
what s the weather in mayotte,GetWeather,0
weather forecast of lakebay ,GetWeather,0
add an album in guitar hero live playlist,AddToPlaylist,0
add this song to country coffeehouse,AddToPlaylist,0
add contact to my nu metal playlist,AddToPlaylist,0
what will the weather be in port costa fm will it be foggy,GetWeather,0
weather in cairngorms-nationalpark close from freezing,GetWeather,0
put limey onto my this is astor piazzolla list,AddToPlaylist,0
what s the weather going to be like in angola twenty minutes from now,GetWeather,0
add the tune by misato watanabe to the trapeo playlist,AddToPlaylist,0
include when i paint my masterpiece in my acoustic spring playlist  ,AddToPlaylist,0
what is the weather here,GetWeather,0
add lunacy to my chill out playlist,AddToPlaylist,0
check the weather for faroe islands ,GetWeather,0
add this tune to retrowave outrun,AddToPlaylist,0
will it be sunny in my current place at 6 am,GetWeather,0
weather for five am in osyka bhutan,GetWeather,0
add the keep your receipt ep to my digster reggae playlist ,AddToPlaylist,0
add classic punk by chab,AddToPlaylist,0
what is the weather in taiwan,GetWeather,0
add lene lovich to my track radar latino,AddToPlaylist,0
put this album on r&b movement,AddToPlaylist,0
add top 100 indie tracks on spotify to my track,AddToPlaylist,0
add house afterwork to my the cave canem demos,AddToPlaylist,0
ad this track by isobel campbell to my folk for kids list,AddToPlaylist,0
what will the weather be like at 3 am in trinidad and tobago,GetWeather,0
add this tune to this is nicky jam,AddToPlaylist,0
add trina to latoya s hillary clinton s women s history month playlist ,AddToPlaylist,0
will a blizzard hit torrey pines state natural reserve on jun  sixteenth,GetWeather,0
will it get chillier in north creek forest,GetWeather,0
is the forecast chillier in 1 hour in mali,GetWeather,0
add radhae unakku kobam aagathadi to my women of metal playlist,AddToPlaylist,0
what is the weather like in wallis and futuna,GetWeather,0
will it be cloudy in guadeloupe next year,GetWeather,0
add geschwisterliebe to my string theory playlist  ,AddToPlaylist,0
will it be warmer in poplar bluff,GetWeather,0
add hey  johnnie cope  are ye waking yet to year in metal 2016 playlist,AddToPlaylist,0
put the frl menke song in my comedy top tracks,AddToPlaylist,0
please add the singer valery kipelov to the perfect concentration list,AddToPlaylist,0
add this track to clásicos del hip hop español,AddToPlaylist,0
please add secrets of the alibi to the playlist called keep calm,AddToPlaylist,0
is there a blizzard coming tomorrow in methuen uganda,GetWeather,0
what s the weather forecast in the same area of me on apr  20,GetWeather,0
forecast for morse shores kansas,GetWeather,0
what s the weather forecast for seychelles,GetWeather,0
show me a forecast for malaysia,GetWeather,0
what is the forecast for hot temps in kuwait in augusta springs,GetWeather,0
put this album by mike tramp on deathcore,AddToPlaylist,0
what s the weather forecast for baker city,GetWeather,0
is it hot in wind ridge guam,GetWeather,0
add a song to ultimate indie,AddToPlaylist,0
will there be a blizzard in oregon,GetWeather,0
tell me the weather forecast for niue,GetWeather,0
add raisins secs et amandes to this is new edition,AddToPlaylist,0
what is the weather in shenandoah heights  montenegro,GetWeather,0
what s the weather close to cambodia at 05:44:13,GetWeather,0
will it get windy close by here,GetWeather,0
add frank beard to my latin pop classics playlist  ,AddToPlaylist,0
what s the weather forecast for tn on december seventh  2026,GetWeather,0
add big generator to my country icon playlist,AddToPlaylist,0
will it be warmer at 15 o clock in deepwater  bonaire,GetWeather,0
i want to add sin rencor to my playlist entitled te quiero,AddToPlaylist,0
tell me if it ll be humid in ga one minute from now,GetWeather,0
will it be overcast during meal time in nh,GetWeather,0
what is the foreast for my current location,GetWeather,0
will it be hotter in pruntytown rhode island,GetWeather,0
i want to add aprite le finestre to my playlist entitled this is earth  wind & fire,AddToPlaylist,0
is there going to be any rainfall close to windber in 365 days,GetWeather,0
i need the weather in nd in three hundred fifty one days ,GetWeather,0
weather for noon in ca,GetWeather,0
will it feel nice here or within the same area,GetWeather,0
add track to afternoon train ride,AddToPlaylist,0
add gregg bissonette to my us latin top 50 playlist,AddToPlaylist,0
will it be overcast at lunch time in saint vincent and the grenadines,GetWeather,0
what is the weather like at emma wood state beach,GetWeather,0
what are the weather conditions in patagonia  south africa,GetWeather,0
warmer condition in haiti  south otselic,GetWeather,0
is there a storm in new mexico in fort sumner ,GetWeather,0
please put this song by nas in my hype playlist,AddToPlaylist,0
add song to my pop brasil,AddToPlaylist,0
how much snow will we get this week in massachusetts,GetWeather,0
add a tune by alex gaudino to my the new waltz playlist ,AddToPlaylist,0
tell me what the weather is here,GetWeather,0
what s the forecast for ks for jan  first,GetWeather,0
what is the forecast for hot temps at bowman bay wildlife sanctuary,GetWeather,0
add this artist to my garage jams,AddToPlaylist,0
add impossible is nothing to spa treatment,AddToPlaylist,0
what is the forecast for harrison–crawford state forest,GetWeather,0
give me the weather forecast for somiedo natural park,GetWeather,0
what s the weather forecast for here,GetWeather,0
what s the forecast far from here in turks and caicos islands,GetWeather,0
put a l lloyd on gaming anthems,AddToPlaylist,0
add no more sorrow to ultra metal,AddToPlaylist,0
what is the weather forecast in 2 seconds for south carolina,GetWeather,0
what will the weather be like may the 10th in rocky boy wi,GetWeather,0
add of rivers and religion to my sexy as folk playlist,AddToPlaylist,0
how windy is it in anderson lake state fish and wildlife area,GetWeather,0
add this roy orbison song onto women of comedy,AddToPlaylist,0
add a song to in residence metal hammer episode 6,AddToPlaylist,0
what does it feel like in east cove national wildlife refuge,GetWeather,0
add robin trower to the medieval 50 spotify picks playlist  ,AddToPlaylist,0
what s the weather in gabon,GetWeather,0
please add this song to my llegando a casa palylist,AddToPlaylist,0
what is the weather like in texas,GetWeather,0
will it be freezing close to my current location,GetWeather,0
add brad kane to the pumping iron soundtrack ,AddToPlaylist,0
can you add through the darkness they march to my once upon a time playlist,AddToPlaylist,0
add live from aragon ballroom to trapeo,AddToPlaylist,0
weather for apr  the thirteenth in djibouti,GetWeather,0
include love love love in the dinner music playlist  ,AddToPlaylist,0
is it hotter close by waubay,GetWeather,0
tell me the weather forecast for my current spot,GetWeather,0
add track to my las canciones más lindas del mundo playlist,AddToPlaylist,0
add lil armstrong to my adrenaline workout playlist,AddToPlaylist,0
my timeless love songs playlist should include viderunt omnes,AddToPlaylist,0
what is the warm forecast for newburyport new caledonia,GetWeather,0
add this artist to my classic punk playlist,AddToPlaylist,0
is it chilly anywhere faraway from my current place,GetWeather,0
i d like to move the artist named matt walker to the playlist grandes unplugged,AddToPlaylist,0
put artist harry burleigh on classical new releases spotify picks,AddToPlaylist,0
add this extended play to women s lit playlist,AddToPlaylist,0
add chér to the still got the blues playlist,AddToPlaylist,0
weather for jun  ninth  2033 in san pierre romania,GetWeather,0
add tunnel of love to ethel s metal crash course palylist,AddToPlaylist,0
i want to put land of the dead into my big daddy s booze & blues playlist  ,AddToPlaylist,0
what s the weather in springside nature reserve at four pm,GetWeather,0
need to see if there will be fog,GetWeather,0
will it be overcast in 1 minute within walking distance of oh,GetWeather,0
add peter banks to verano forever list,AddToPlaylist,0
add el valle del jarama to my working day playlist,AddToPlaylist,0
add this tune to the spinnin  records top 100 list,AddToPlaylist,0
add tune to morning rhythm playlist,AddToPlaylist,0
what will the weather be ten minutes from now in canada,GetWeather,0
is it going to be stormy in austin creek state recreation area at 09:42,GetWeather,0
tell me what the weather will look like here at 01:50,GetWeather,0
will there be sun ten minutes from now in uintah,GetWeather,0
add janie jones to my indie pop,AddToPlaylist,0
add the album to the psychedelic rock playlist ,AddToPlaylist,0
was the weather colder last august at stunt ranch santa monica mountains reserve,GetWeather,0
add little pattie track in nu metal,AddToPlaylist,0
add another album to my keep calm playlist  ,AddToPlaylist,0
add barbara to the metal xplorer playlist  ,AddToPlaylist,0
tell me if there will be a snowstorm on sep  the second  2028 in olpe,GetWeather,0
add m-cabi to the playlist named pre-party r&b jams,AddToPlaylist,0
add this song onto my playlist entitled chill out ,AddToPlaylist,0
i want you to add must b 21 to acoustic covers the mash ups ,AddToPlaylist,0
add totally stress free by bobby lord to my playlist,AddToPlaylist,0
add blue feather to the nature noise playlist,AddToPlaylist,0
what will the temperature be at midnight in ne,GetWeather,0
add cake to bake to lo que suena new york,AddToPlaylist,0
add the tune to my house afterwork playlist ,AddToPlaylist,0
what is the weather forecast in ulen on mar  2nd  2035,GetWeather,0
place this tune in workout remix,AddToPlaylist,0
forecast for econfina,GetWeather,0
i need the forecast for hot in barbados may city in 1 year ,GetWeather,0
please add moon river to my metalcore playlist,AddToPlaylist,0
play elizeth cardoso to my nothing but a party r&b playlist,AddToPlaylist,0
add welcome to the cruel world to my reggae classics,AddToPlaylist,0
the get going playlist needs another song ,AddToPlaylist,0
how is the weather going to be on child health day in trinidad and tobago,GetWeather,0
add the little house we built onto mucho rap,AddToPlaylist,0
what s the weather forecast for austin liechtenstein,GetWeather,0
add when you come back to the jazz for loving couples playlist  ,AddToPlaylist,0
put this artist on my folk for kids playlist,AddToPlaylist,0
will there be snowfall faraway from robinson forest,GetWeather,0
forecast for my current location at 6,GetWeather,0
add theater to my new metal tracks playlist,AddToPlaylist,0
what is the humidity like in leoti,GetWeather,0
what s the forecase for inverness on february 5th  2031,GetWeather,0
add fred knoblock to my lo-fi love playlist,AddToPlaylist,0
what is the weather for yemen,GetWeather,0
add back on the dancefloor to my bajo las estrellas playlist,AddToPlaylist,0
how is the weather going to be this week in roseau  ia ,GetWeather,0
what is the chilly forecast for mustoe north carolina,GetWeather,0
what s the weather in hi,GetWeather,0
what s the weather forecast in the same area as la in 1 minute,GetWeather,0
will it be foggy here,GetWeather,0
will there be a blizzard in egypt on jul  3,GetWeather,0
ad amal hijazi tune to my pura vida,AddToPlaylist,0
is it cloudy in choptank,GetWeather,0
will it be colder in az than tx today,GetWeather,0
can you put consequences on my sos 48 2016 playlist,AddToPlaylist,0
add song to my eletro br playlist,AddToPlaylist,0
i want this tune on my most necessary playlist,AddToPlaylist,0
what will the weather be like in new glarus,GetWeather,0
what s the humidity now in nh,GetWeather,0
is it going to be cold in readstown at 4 am,GetWeather,0
is it going to get any hotter in kerrick,GetWeather,0
add gene clark to diann s chill out list,AddToPlaylist,0
how is colder in city of rocks state park around 03:43 pm,GetWeather,0
add farruko presenta los menores to my amor amor playlist,AddToPlaylist,0
is it forecast to be chillier in latvia,GetWeather,0
add this song to rock party,AddToPlaylist,0
is the weather chilly in dew de,GetWeather,0
will there be a blizzard in kettleman city today,GetWeather,0
what s the weather forecast for anniston,GetWeather,0
add track to my gold edition playlist,AddToPlaylist,0
what is the weather one second from now in blue ridge berryessa natural area,GetWeather,0
how will the weather be in six minutes close to moosic,GetWeather,0
add the current tune to my rock gaming playlist,AddToPlaylist,0
what is the weather forecast in nine months within walking distance of ohio,GetWeather,0
put strange days onto the fusion fest playlist ,AddToPlaylist,0
add bone crusher to the chill out playlist,AddToPlaylist,0
my indietronic playlist needs until the end of time added,AddToPlaylist,0
add arthur lee to my jazz vibes playlist,AddToPlaylist,0
tell me the weather forecast for douglas state forest,GetWeather,0
add ihsahn to hip hop 2017 new school,AddToPlaylist,0
what is the weather like in ia in april,GetWeather,0
is there snowfall in zec mitchinamecus at 13,GetWeather,0
what is the meal time forecast for cayman islands,GetWeather,0
what s the weather like in forty fort,GetWeather,0
i need to add a song to my lo que suena new york playlist ,AddToPlaylist,0
what is the weather forecast for monument of lihula,GetWeather,0
what is the forecast for the distant future in sugar bush,GetWeather,0
will it be windy at medicine rocks state park on may 24,GetWeather,0
what is the weather forecast for theodore roosevelt inaugural national historic site,GetWeather,0
will it hail today in west point at 11:36:48,GetWeather,0
can my electro sur have this song added to it,AddToPlaylist,0
add hello central  give me heaven to indie pop,AddToPlaylist,0
what will the weather be like here on dec  8  2019,GetWeather,0
add track to orgullo gay,AddToPlaylist,0
i want to add george formby  jr to the family favorites playlist,AddToPlaylist,0
give me the weather forecast for wisconsin dells in saint kitts and nevis on the day after tomorrow,GetWeather,0
what s the weather in singapore,GetWeather,0
add roel van velzen to the night playlist  ,AddToPlaylist,0
add songs in 90 s hip hop of artist,AddToPlaylist,0
will it be windy in mission bay  ak today,GetWeather,0
will it be sunny in corcovado indonesia,GetWeather,0
will it snow on apr  eighteenth  2029 in myanmar,GetWeather,0
is there a depression going on in uganda,GetWeather,0
include golden boy in pop dance,AddToPlaylist,0
put this album into becky s infinite indie folk playlist,AddToPlaylist,0
add this track to the playlist kickass metal,AddToPlaylist,0
how is the weather in edesville  mn,GetWeather,0
add det kimer nu til julefest to my playlist technical&brutal death metal,AddToPlaylist,0
will it be windy at two pm in france,GetWeather,0
show weather forecast at three am in wauregan,GetWeather,0
please put maimi yajima s song onto operación bikini ,AddToPlaylist,0
will there be snowfall in zero pm in estonia,GetWeather,0
add this album to my blues playlist,AddToPlaylist,0
what s the weather forecast in guadeloupe eleven weeks from now ,GetWeather,0
add transmission to my found them first,AddToPlaylist,0
what will the weather be like nine years from now in eastport el salvador,GetWeather,0
add splendido hotel to my verano forever,AddToPlaylist,0
add this artist named trevor mcnevan to the playlist top gaming tracks,AddToPlaylist,0
add this artist to my throwback dance party playlist,AddToPlaylist,0
will it be rainy this monday in le center  thailand,GetWeather,0
what s the weather like around laos,GetWeather,0
what is the forecast in the same area as fiji,GetWeather,0
will it be hot in keachi,GetWeather,0
add bslade to women of k-pop playlist,AddToPlaylist,0
weather for lowden ok,GetWeather,0
add chen jiafeng to ultimate 00s,AddToPlaylist,0
what does it feel like in connecticut,GetWeather,0
add the muppet show 2 to my party through the decades,AddToPlaylist,0
add ian gillan to my rock party,AddToPlaylist,0
add fra mols til skagen to my this is trey songz playlist,AddToPlaylist,0
what is the weather in the netherlands,GetWeather,0
what is the mississippi for the week,GetWeather,0
what kind of weather will be in windy hills  bermuda in ten weeks ,GetWeather,0
what will the weather conditions be in hahntown  wyoming at 1,GetWeather,0
will it get rainy like last march in hagerman  saint vincent and the grenadines,GetWeather,0
can you give me the forecast for 10:15 in paraguay,GetWeather,0
add tune papa bue to éxitos españa playlist,AddToPlaylist,0
will it be cold in boyertown new zealand in eighteen hours ,GetWeather,0
check the weather for eagle harbor  tanzania,GetWeather,0
what is the oct  10 forecast for cuyabeno wildlife reserve,GetWeather,0
add something by arnett cobb to my la mejor música para tus fiestas playlist,AddToPlaylist,0
will it be cold in harveysburg wa,GetWeather,0
i want to add un jour dans notre vie to my list running to rock 170 to 190 bpm,AddToPlaylist,0
what is the bahamas forecast for stormy weather at 07:43:21,GetWeather,0
put a molly mcguire album in my metal talks kreator playlist  ,AddToPlaylist,0
will it be temperate here on 11/27/2023,GetWeather,0
matt monro newest album add to my chill out music,AddToPlaylist,0
add this teddy charles album to this is pavarotti my playlist ,AddToPlaylist,0
what will the weather be like in brownfield,GetWeather,0
add novedades pop to my all out of luck list,AddToPlaylist,0
is it going to be hot on oct  the 8th  2020 in the neighboring greenland area,GetWeather,0
please add emanuel kiriakou to my playlist llegando a casa,AddToPlaylist,0
add album to my grandes unplugged,AddToPlaylist,0
i need to know the weather for hamorton  tn,GetWeather,0
put artist serenata onto my massive soca hits list,AddToPlaylist,0
add artist to my endorphin rush playlist,AddToPlaylist,0
what is the weather like within walking distance of the nationalpark drawa,GetWeather,0
add cliffs of dooneen in playlist lo que suena los angeles,AddToPlaylist,0
what is the weather forecast for wa on september 11  2021,GetWeather,0
what is the bolsa chica state beach forecast for foggy conditions,GetWeather,0
add this artist to the playlist cool jazz,AddToPlaylist,0
is it supposed to be stormy in seagraves,GetWeather,0
can you add something by faultline to jannie s strength of street knowledge playlist,AddToPlaylist,0
add this album by richard hell to arlene s playlist named miami 2017 guest list,AddToPlaylist,0
is it going to be windy here on nov  17,GetWeather,0
is it supposed to be sunny here,GetWeather,0
weather here at two pm,GetWeather,0
add there is nothing like a dame to my playlist guest list take,AddToPlaylist,0
stick fonseca in the songs to sing in the car playlist,AddToPlaylist,0
add tune to my playlist picnic in the park,AddToPlaylist,0
what is the temperate in uintah right now,GetWeather,0
what is the weather close to somesville on mon ,GetWeather,0
what is the weather forecast for maryland,GetWeather,0
add a billy strayhorn song to my the selektor playlist,AddToPlaylist,0
add jan smit in endorphin rush,AddToPlaylist,0
will it be overcast at night in kenmore  fl,GetWeather,0
is it going to be warmer in town kelloe bank,GetWeather,0
add sweets edison to relaxing playlist,AddToPlaylist,0
add raz b to drive playlist,AddToPlaylist,0
what will the weather be in allenwood,GetWeather,0
will the sun come out here,GetWeather,0
what s the weather in germantown hills,GetWeather,0
add ana carolina to chill,AddToPlaylist,0
show weather forcast for february the 8th on current spot in neighboring,GetWeather,0
is it forecast to be windy here in seven seconds,GetWeather,0
will it colder here on 11/18/2018,GetWeather,0
what will the weather be like 56 weeks from now  will there be sun in tabor,GetWeather,0
will it be chilly in ma 12 days from now,GetWeather,0
i want to add anna semenovich to the dinner with friends playlist,AddToPlaylist,0
check the weather forecast in seven weeks for emida ,GetWeather,0
what is the current spot forecast for far areas and warmer temps,GetWeather,0
is it going to storm in ne,GetWeather,0
is there snowstorm in la,GetWeather,0
what is the weather forecast for minnesota,GetWeather,0
what s the forecast for jefferson national expansion memorial around eight am,GetWeather,0
put jtr on the top classical playlist,AddToPlaylist,0
will it be even hotter 2 years from now in el jebel  niger,GetWeather,0
will it be colder at midnight in washington,GetWeather,0
add this artist to the playlist called evening groove ,AddToPlaylist,0
add this song to enid s romántica playlist,AddToPlaylist,0
put a track into my classic country playlist ,AddToPlaylist,0
add this artist to romántica,AddToPlaylist,0
add track to this is zezé di camargo & luciano playlist,AddToPlaylist,0
i want another song in my rock español playlist  ,AddToPlaylist,0
put this jerry dixon song onto my tokyo rising playlist ,AddToPlaylist,0
put donnie g don gorilla on my classical romance playlist,AddToPlaylist,0
add devil pray to my party list,AddToPlaylist,0
add yma sumac to this is animal collective,AddToPlaylist,0
add artist chris squire to my the birth of cool playlist,AddToPlaylist,0
play suus to my the funny thing about football is playlist,AddToPlaylist,0
tell me the weather forecast for my current spot on dec  fourth  2021,GetWeather,0
add thomas anders to my crossroad blues,AddToPlaylist,0
will there be any snowfall in american samoa,GetWeather,0
put gregory douglass in halloween teens please,AddToPlaylist,0
add this artist to spring music,AddToPlaylist,0
i want to put paul young onto all new all now ,AddToPlaylist,0
add me kommeni tin anasa to my propuesta alternativa playlist,AddToPlaylist,0
add the album to the top 100 country tracks on spotify playlist ,AddToPlaylist,0
what will be the weather like in turks and caicos islands around dec  sixth  2032,GetWeather,0
add this adam clayton tune to sxsw fresh playlist,AddToPlaylist,0
"add kenneth c ""jethro"" burns songs in my playlist soundscapes for gaming",AddToPlaylist,0
what will it feel like on patriot s day on south georgia and the south sandwich islands,GetWeather,0
i want you to add the currently playing this generation into my playlist called funtime activity,AddToPlaylist,0
is it warmer in monson  u s  minor outlying islands,GetWeather,0
will it be cold in wheatley provincial park,GetWeather,0
add artist my laundry playlist,AddToPlaylist,0
