text,labels,is_ood
is it warm in new jersey in 23 minutes and fourteen seconds,GetWeather,0
is it freezing in vega alta,GetWeather,0
i would like to put taylor dayne on the pop 4 kids list,AddToPlaylist,0
add maria magdalena to my poetry in their own voices playlist,AddToPlaylist,0
add a jacob miller album to my hardcore punk playlist  ,AddToPlaylist,0
is rainfall forecast for flying hills,GetWeather,0
add song to zen focus playlist,AddToPlaylist,0
what will the weather be a nine in willow river state park,GetWeather,0
what is the weather forecast for shasha forest reserve in 43 weeks,GetWeather,0
weather forecast for snowstorm on feb  fourth in virgin islands,GetWeather,0
put hugh masekela onto my music on ibiza guest list playlist,AddToPlaylist,0
i d like to add this album to my siesta playlist,AddToPlaylist,0
will it be foggy now close to jolley,GetWeather,0
what s the humidity right now in aguila,GetWeather,0
add moby grape live to enamorándose,AddToPlaylist,0
i need to know the forecast for two am in grand lake towne,GetWeather,0
add metal gear solid 2 sons of liberty soundtrack 2 the other side to edna st vincent millay,AddToPlaylist,0
add this song to my workout playlist,AddToPlaylist,0
add track  to this is puccini,AddToPlaylist,0
put perfecting loneliness onto primavera sound 2016 barcelona ,AddToPlaylist,0
is it snowy in audra state park or within the same area,GetWeather,0
what s the forecast for this month in apple grove  dc,GetWeather,0
what is the forecast for the current position,GetWeather,0
add an artist to my playlist domingo indie,AddToPlaylist,0
will it be hotter at nine am in serbia,GetWeather,0
add the darkest red to this is jennifer lopez,AddToPlaylist,0
what will the weather be in federated states of micronesia at 00:17 am,GetWeather,0
add album to this is trey songz playlist,AddToPlaylist,0
add the tune to my viajes playlist,AddToPlaylist,0
what is the weather in the falkland islands,GetWeather,0
what s the forecast for castolon in french southern territories around seven pm,GetWeather,0
i want do you want to build a snowman in my hip hop 2017 new school playlist,AddToPlaylist,0
add artist to my playlist primavera sound 2016 barcelona,AddToPlaylist,0
i want maximilian mutzke added to acoustic concentration,AddToPlaylist,0
is it humid in kuwait,GetWeather,0
how will the weather be in bettles  aruba on may the tenth  2026,GetWeather,0
will it be colder in colorado nine months from now,GetWeather,0
i want another artist on my atmospheric black metal playlist,AddToPlaylist,0
add jermaine fagan to spring music,AddToPlaylist,0
add this album the the playlist canciones que lo van a petar,AddToPlaylist,0
add another song to the acoustic soul playlist ,AddToPlaylist,0
what does it feel like in alloway,GetWeather,0
add a tune to the this is animal collective playlist ,AddToPlaylist,0
is az has chilly weather,GetWeather,0
what s the weather like in north brunswick township virginia,GetWeather,0
can 50 minute technicolor dream be added to meredith s cierra la puerta playlist,AddToPlaylist,0
show me the forecast for anatone louisiana on november 7th,GetWeather,0
tell me the weather forecast for missouri,GetWeather,0
what is the weather going to be like in epleys in south georgia and the south sandwich islands in 11 months,GetWeather,0
add kevin ridel to instrumental madness,AddToPlaylist,0
add a track to my dinner playlist,AddToPlaylist,0
add the artist joseph meyer to my mad cool festival 2017 playlist,AddToPlaylist,0
what will be the night temperate in indiana,GetWeather,0
please add faccetta nera to my this is handel playlist,AddToPlaylist,0
add mel draisey tomy 80s classic hits playlist ,AddToPlaylist,0
is the weather freezing in ak,GetWeather,0
is it cold in breckenridge  colorado,GetWeather,0
add candlelight to my house afterwork playlist ,AddToPlaylist,0
tell me the weather forecast for my current spot,GetWeather,0
i want to put this track on diann s just smile playlist,AddToPlaylist,0
tell me the forecast for rogers city  ms,GetWeather,0
add feel the passion to my this is kudai playlist  ,AddToPlaylist,0
what s the weather forecast for here in august,GetWeather,0
add the artist to my spooning playlist,AddToPlaylist,0
is there expected of rainfall in horton of connecticut,GetWeather,0
add this track by brian welch to the spring music playlist,AddToPlaylist,0
i need the forecast for mamaroneck in six weeks,GetWeather,0
add this album to my throwback thursday playlist,AddToPlaylist,0
add steve albini album to my psychedelic rock playlist,AddToPlaylist,0
add a tune in chill vibes,AddToPlaylist,0
add shot forth self living to my folk metal warriors playlist ,AddToPlaylist,0
tell me if it ll be colder in steptoe battlefield state park in one minute,GetWeather,0
add roger nichols to punk rock workout,AddToPlaylist,0
can you add something by wynter gordon to my soul lounge playlist,AddToPlaylist,0
how s the weather going to be at fourteen o clock in falkland islands,GetWeather,0
add picasso baby to digster reggae playlist,AddToPlaylist,0
add album radar latino,AddToPlaylist,0
is it warm faraway in niger,GetWeather,0
add ajoy chakrabarty to women of country playlist,AddToPlaylist,0
what s the forecast for georgia,GetWeather,0
give me the weather forecast for here,GetWeather,0
put this song on the chips and salsa playlist,AddToPlaylist,0
is it going to be warm in palmview,GetWeather,0
add don sebesky song to the refugee playlist,AddToPlaylist,0
add artist to my trance life group,AddToPlaylist,0
will it be temperate near neylandville,GetWeather,0
add michael lepond to electronic bliss,AddToPlaylist,0
add this song to my list trabajo relax,AddToPlaylist,0
rate tune to my natalie macmaster viajes,AddToPlaylist,0
what s the weather in meherrin,GetWeather,0
what will the weather be in post falls on feb  17,GetWeather,0
can you add something by snow onto my zen focus playlist,AddToPlaylist,0
weather at stanford at six am,GetWeather,0
how warm is it in darnestown,GetWeather,0
what is the forecast for colder in anston,GetWeather,0
add one good reason to the bachelor party playlist,AddToPlaylist,0
put this album on totally alternative,AddToPlaylist,0
add this tune to my list jazz vibes,AddToPlaylist,0
add the current artist to my top 100 pop tracks on spotify playlist,AddToPlaylist,0
i want to add the tim smith album to my best of 2010 s playlist,AddToPlaylist,0
is it supposed to be sunny here,GetWeather,0
add another track to my catch  em all playlist  ,AddToPlaylist,0
show me a forecast for french polynesia,GetWeather,0
will the weather be temperate on jan  the thirteenth  2028 at christmas island ,GetWeather,0
book me a restaurant in aransas pass in seventeen hours,GetWeather,0
add the pop tarts to my this is astor piazzolla playlist,AddToPlaylist,0
add karin dreijer andersson in escapada album,AddToPlaylist,0
will it be snowy in pillow indiana,GetWeather,0
add the game to 80 s party,AddToPlaylist,0
add artist to my friendesemana playlist,AddToPlaylist,0
i want new steps to go on the leche con chocolate list,AddToPlaylist,0
add petar georgiev kalica song to my push button funk playlist,AddToPlaylist,0
the enamorándose playlist needs another album  ,AddToPlaylist,0
add this tune by hart wand on this is wagner,AddToPlaylist,0
add inca roads to my weekend,AddToPlaylist,0
add yang hyun seok to the playlist called night out,AddToPlaylist,0
is there a depression in delta junction,GetWeather,0
add another album to my friendesemana playlist  ,AddToPlaylist,0
i want to book a restaurant in 40 weeks in iowa ,GetWeather,0
will there be a storm nearby,GetWeather,0
will there be wind in me,GetWeather,0
add teenager to the queen playlist,AddToPlaylist,0
how is faraway cloudy at 02:45 am in brumley,GetWeather,0
add joe gibbs to my the bachelor party playlist,AddToPlaylist,0
add o b mcclinton to my playlist called women of electronic,AddToPlaylist,0
i want to add kool keith to my chill out dinner playlist,AddToPlaylist,0
add the tune to my epic classical playlist ,AddToPlaylist,0
add kjetil vidar haraldstad to my para entrenar playlist  ,AddToPlaylist,0
what is the weather forecast for papua new guinea,GetWeather,0
send the track from andrew hewitt to the piano ballads playlist,AddToPlaylist,0
put united abominations onto my rare groove playlist,AddToPlaylist,0
put bring me down onto my tokyo rising playlist,AddToPlaylist,0
tell me the weather forecast in 4 years and a half in ga,GetWeather,0
please put david van tieghem onto my throwback party playlist ,AddToPlaylist,0
please add this rex griffin tune to the steampunk playlist,AddToPlaylist,0
add desert sessions to my i love my 80 s rollerdisco playlist,AddToPlaylist,0
tell me if it ll be chillier now in engadine,GetWeather,0
add josephine wiggs to my kickass metal playlist  ,AddToPlaylist,0
i want another album in my disco fever playlist  ,AddToPlaylist,0
add atticus ross to the electrosafari playlist,AddToPlaylist,0
what is the afternoon forecast for shannon and pitcairn islands,GetWeather,0
check the forecast for natchaug state forest,GetWeather,0
add bert mccracken tune lo que suena new york playlist,AddToPlaylist,0
what is the weather in kernersville greece,GetWeather,0
please add to my playlist hype the name introducing a r rahman,AddToPlaylist,0
find focus now list and add eylem to my playlist,AddToPlaylist,0
what is the weather forecast for sep  the 14th  2038 in north dakota,GetWeather,0
add joshua radin to my playlist called futuros hits,AddToPlaylist,0
is there a storm in the weather forecast for baraga oregon,GetWeather,0
in taiwan will there be rainfall in willimantic,GetWeather,0
what is the weather forecast here,GetWeather,0
what will the weather forecast be in mount victory  delaware in 1 second,GetWeather,0
add opus de funk to my list acoustic blues,AddToPlaylist,0
add 2012 zwanzig zwölf to my miami 2017 guest list,AddToPlaylist,0
put frank farian on my deep dark indie folk playlist,AddToPlaylist,0
what will it be like in six pm at the current place,GetWeather,0
what will the weather be in virginia,GetWeather,0
add ultimatum to my crash course playlist,AddToPlaylist,0
how cold is it in martinique,GetWeather,0
add ashley cafagna tesoro to my reggae en español list,AddToPlaylist,0
put king of america onto the playlist with the title a sudden rainstorm,AddToPlaylist,0
add camille to the this is lady antebellum playlist,AddToPlaylist,0
weather for 9/3/2034 at bridle trails state park,GetWeather,0
is it getting colder in leonard harrison state park,GetWeather,0
add harry chapin in stress relief playlist,AddToPlaylist,0
will it be windy at 7 am in dong phou vieng national protected area,GetWeather,0
will it get warmer by 5 am in washington,GetWeather,0
what will the weather be like tonight at greenfoot quarry,GetWeather,0
add joplin in concert to my feel good dinner,AddToPlaylist,0
what are the weather conditions in noel,GetWeather,0
i want to add a tune by damon johnson to my frescura indie playlist,AddToPlaylist,0
tell me the weather forecast for korona,GetWeather,0
what s the weather like at powers lake,GetWeather,0
add track to my spring playlist,AddToPlaylist,0
united states has warm weather on next wed ,GetWeather,0
add this artist to my feel good dinner playlist,AddToPlaylist,0
add this track to morning classical,AddToPlaylist,0
add tarte to bandas sonoras playlist,AddToPlaylist,0
book a restaurant 1 hour from now in dorchester shores reservation,GetWeather,0
will there be a blizzard at a 4 am  in sky valley,GetWeather,0
will it hail in villa,GetWeather,0
add artist to todo edm,AddToPlaylist,0
can you tell me the weather forecast for six am in grenada,GetWeather,0
add the singer damon johnson album to my african heat playlists,AddToPlaylist,0
add a song to playlist chill hits,AddToPlaylist,0
add the artist verano to my michael mantler playlist  ,AddToPlaylist,0
what is the weather forecast for july 20  2020 in dachigam-nationalpark,GetWeather,0
add partners in crime to joann s lo que suena los angeles,AddToPlaylist,0
i want harris to be added to my latin dance cardio playlist,AddToPlaylist,0
is it going to be colder in queen anne on mon ,GetWeather,0
add ernie hawkins to the dubstep playlist  ,AddToPlaylist,0
will the weather be temperate 22 minutes from now in alba,GetWeather,0
add an album to my sylvia plath playlist ,AddToPlaylist,0
add the greyest of blue skies in indie español my playlist,AddToPlaylist,0
add this album to rock en español,AddToPlaylist,0
add lapponia to my flamenco pa ti playlist  ,AddToPlaylist,0
add another song to daphne s retrowave outrun playlist  ,AddToPlaylist,0
show weather forecast for dovre-nationalpark,GetWeather,0
tell me if it will rain on 4/19/2030 in angola,GetWeather,0
what s the forecast for right here,GetWeather,0
what will the weather be like on january the twenty-third  2034 in ga,GetWeather,0
will it be hot on december 28 in ayr  mi,GetWeather,0
at my current spot is it going to be hotter on nov  the eighth,GetWeather,0
give me the weather forecast for nationaal park garphyttan,GetWeather,0
add track to dance playlist,AddToPlaylist,0
will it get chillier within walking distance of pw,GetWeather,0
what will the weather be for hooksett,GetWeather,0
i need to know the weather at the queen elizabeth national park,GetWeather,0
add warm and beautiful to the ironing playlist  ,AddToPlaylist,0
how temperate will it be in blyde river canyon nature reserve on jul  the 18th,GetWeather,0
add this tune to my primavera sound 2016 barcelona,AddToPlaylist,0
what is the baotianman national nature reserve forecast,GetWeather,0
add a song by claude vonstroke to the under the surface playlist ,AddToPlaylist,0
add arthur russell to my women of disco playlist  ,AddToPlaylist,0
add david cole to an instrumental sunday,AddToPlaylist,0
what is mo forecast for hotter temps in kalkaska,GetWeather,0
what is the forecast for the current place for sun on january sixth  2028 within walking distance,GetWeather,0
is it going to be windy faraway from the valley of fire,GetWeather,0
add enduser song in grime instrumentals,AddToPlaylist,0
add track to kickass metal,AddToPlaylist,0
is it going to be sunny on oct  twenty-seventh  2031 within the same area of this current place,GetWeather,0
add another mc chris track to my blues roots playlist  ,AddToPlaylist,0
add this tune to my 70s road trip list,AddToPlaylist,0
what is the forecast for a day from now in liechtenstein,GetWeather,0
what s the weather this summer in djibouti,GetWeather,0
what will the weather be in double oak at 12 am,GetWeather,0
please put another tune into the laundry playlist  ,AddToPlaylist,0
put this tune onto the signed xoxo playlist ,AddToPlaylist,0
add this jane olivor track to my the sleep machine waterscapes,AddToPlaylist,0
tell me if it will it be windy in grizzled squirrel wildlife sanctuary,GetWeather,0
will there be a blizzard in egypt,GetWeather,0
what is weather in azerbaijan 16 seconds from now,GetWeather,0
include the album by arthur rhames in urban poet,AddToPlaylist,0
what is the twenty one o clock forecast for the current spot,GetWeather,0
what is the forecast for 6 am in aruba,GetWeather,0
how much wind will there be in nm on november 11th,GetWeather,0
add track to my digster future hits,AddToPlaylist,0
will it rain 17 weeks from now in teide national park,GetWeather,0
what s the weather forecast for the northern mariana islands on 8/4/2024,GetWeather,0
add jim martin to deathcore ,AddToPlaylist,0
check the forecast for hulmeville  wv ,GetWeather,0
add villotta to the metalsucks playlist playlist,AddToPlaylist,0
add bill evans to the motivation mix playlist ,AddToPlaylist,0
add this tune to my rock this,AddToPlaylist,0
put transatlantic lullaby on sharlene s napoleon xiv playlist,AddToPlaylist,0
what will the weather be in catahoula national wildlife refuge,GetWeather,0
tell me the forecast for elderton  indiana in 19 hours,GetWeather,0
tell me the weather forecast 1 hour from now in big thicket national preserve,GetWeather,0
what is the forecast for dr  julian g  bruce st  george island state park for rainy weather,GetWeather,0
will it be chilly in two hundred thirteen days at dochū-kōtsu prefectural natural park,GetWeather,0
i need to add a tune by amanda stern to the playlist cloud rap ,AddToPlaylist,0
add a song from randy rhoads to my 50 clásicos playlist,AddToPlaylist,0
add kansas city  missouri to stress relief,AddToPlaylist,0
add i’m only a man to my flow español,AddToPlaylist,0
on may the thirteenth  2037 what will it be like in wilderville  montenegro,GetWeather,0
will there be a snowstorm at my current place,GetWeather,0
weather for marshall,GetWeather,0
i wish to put tom baxter onto my coffee table jazz playlist,AddToPlaylist,0
will it be foggy on the town meeting day vermont in angola,GetWeather,0
weather for now in cape romain national wildlife refuge,GetWeather,0
add tune to downtempo beats,AddToPlaylist,0
add artist steve cropper to rhythm and blues,AddToPlaylist,0
she me the weather in the current place for nov  the 9th,GetWeather,0
i want another track added to the korean osts playlist  ,AddToPlaylist,0
what will the weather be in rutherfordton rhode island on september 22nd  2017,GetWeather,0
for my playlist post garage wave revival add the name  eternal prisoner ,AddToPlaylist,0
what will be the weather like close by kackley,GetWeather,0
put jiro in my clásicos del hip hop español playlist  ,AddToPlaylist,0
add put your hand inside the puppet head to the playlist named lazy chill afternoon,AddToPlaylist,0
please add this song to indiespain list,AddToPlaylist,0
add song to sleepytime,AddToPlaylist,0
put glenn stetson to my your daily routine playlis,AddToPlaylist,0
will it be colder at five o clock at the apolobamba integrated management natural area,GetWeather,0
include sean yseult in kaitlin s metal overload playlist  ,AddToPlaylist,0
how chilly will it get here ,GetWeather,0
is saint robert hotter than turkmenistan,GetWeather,0
add progress to my clásica para todos playlist  ,AddToPlaylist,0
include the past behind in my top 100 rock tracks on spotify playlist  ,AddToPlaylist,0
add an espen lind song to my list lo que suena new york,AddToPlaylist,0
what will the weather be like in arizona on october the 3rd,GetWeather,0
what s the weather forecast near to fern creek this winter,GetWeather,0
what s the weather forecast for aug  8  2020 at my current location,GetWeather,0
what is the weather forecast in canfield at 22:23:22,GetWeather,0
is there hail forecast for hale center on 7/22/2030,GetWeather,0
forecase for ohio in twenty one hours and one second,GetWeather,0
will it rain today in french southern territories of highland beach,GetWeather,0
need weather forecast for stacy in vanuatu ,GetWeather,0
what s the forecast for al twenty one minutes from now,GetWeather,0
is temperature in hanksville freezing ,GetWeather,0
add john brown to my dinnertime acoustics,AddToPlaylist,0
add a compilation of warped music ii to workout twerkout playlist,AddToPlaylist,0
is it overcast in south carolina,GetWeather,0
is there a blizzard in tennessee colony  ks,GetWeather,0
is it going to be temperate at six am in washington,GetWeather,0
add this song to the novedades pop playlist,AddToPlaylist,0
is it chillier here,GetWeather,0
how chilly will it be at 09:32:06 am in moncove lake state park,GetWeather,0
is it hot in zephyrhills,GetWeather,0
what s the weather going to be like in fort point  san francisco tomorrow,GetWeather,0
add another song to the acoustic soul playlist ,AddToPlaylist,0
weather within the same area as qatar at four,GetWeather,0
is it going to be chilly today in abo  wi,GetWeather,0
add unconscious state to my 90s smash hits,AddToPlaylist,0
add an album to corinne s beast mode playlist ,AddToPlaylist,0
what s the weather forecast for here,GetWeather,0
add this track to my this is thomas rhett playlist,AddToPlaylist,0
how snowy will it be in this current place on feb  first  2034,GetWeather,0
give me a forecast for carol city,GetWeather,0
add the chamillionaire track to lina s wedding classics playlist,AddToPlaylist,0
add the album to the six string peacefulness playlist,AddToPlaylist,0
add come on a cone to power walk playlist,AddToPlaylist,0
what s the weather at zero pm in papeton montserrat,GetWeather,0
add boyce and hart to urban hits playlist,AddToPlaylist,0
add the tune to your favorite slaughterhouse playlist ,AddToPlaylist,0
tell me the weather for comertown,GetWeather,0
will it be hot three minutes from now faraway from saint croix state park,GetWeather,0
add the artist michael schenker to ina s this is jennifer lopez playlist,AddToPlaylist,0
tell me the weather forecast for equatorial guinea,GetWeather,0
is it snowy in fort ross state historic park,GetWeather,0
how cloudy is it in morrisonville  kentucky,GetWeather,0
add something by paul whiteman to my sweet soul chillout playlist please,AddToPlaylist,0
what s the weather forecast for my current position,GetWeather,0
in two hundred forty eight days  what will mp weather be like,GetWeather,0
for my playlist jazzy dinner add the name kick over the traces,AddToPlaylist,0
what is the close by greenland forecast,GetWeather,0
i need the weather at noon for e a  vaughn wildlife management area,GetWeather,0
tell me if it ll be snowy in coastal landscape park on october 2  2027,GetWeather,0
is it hotter here,GetWeather,0
put tony rombola on my novedades viernes sudamérica playlist,AddToPlaylist,0
what is the weather forecast for cuba at eleven am,GetWeather,0
will it be hot in new york on october the 1st  2026,GetWeather,0
what will the weather be in cummings mississippi in eleven years ,GetWeather,0
will it be chillier in saxis north dakota,GetWeather,0
put take up thy stethoscope and walk onto my verano playlist,AddToPlaylist,0
weather for swaziland,GetWeather,0
how will the weather be in bhutto family mausoleum next autumn,GetWeather,0
what is the weather forecast nearby sc,GetWeather,0
what is the forecast for de on 9/11/2035,GetWeather,0
add song by emmy rossum to hit rewind,AddToPlaylist,0
can you put tire me onto my new music friday latin playlist,AddToPlaylist,0
will it be chillier in la mesa,GetWeather,0
add my hands to travelling playlist,AddToPlaylist,0
please include danni bassan in my perfect concentration,AddToPlaylist,0
add artist rob dougan to electronow,AddToPlaylist,0
is it going to be nice at 6 am at chippewa lake,GetWeather,0
add igor talkow to my women of k-pop list,AddToPlaylist,0
what will the weather by close by the current position at 02:02:30,GetWeather,0
add the artist p d q bach to the te quiero playlist,AddToPlaylist,0
add  michael balzary to mujeres y hombres y fiesta,AddToPlaylist,0
what s the weather forecast for the area neighboring ks this autumn,GetWeather,0
is the forecast colder in idaho 1 second from now,GetWeather,0
can you add a tune to my jazzy romance playlist,AddToPlaylist,0
tell me the weather forecast for huxley  ms,GetWeather,0
what is the cloud coverage in my current place,GetWeather,0
is it warm in sierra blanca now,GetWeather,0
add xiang xiang album to my madden nfl 16,AddToPlaylist,0
will it be warm here in one hour,GetWeather,0
add the tune by cassie ventura to my genre bender playlist,AddToPlaylist,0
add deus deceptor to dance workout,AddToPlaylist,0
can you put this tune onto latin dance cardio,AddToPlaylist,0
put beside you in my spotify orchestra cello playlist  ,AddToPlaylist,0
add what if we were real to my ultimate 80s playlist,AddToPlaylist,0
what s the weather like in groesbeck,GetWeather,0
add this album to my hot house playlist,AddToPlaylist,0
what is the weather forecast for colfax  senegal on 1/1/2031,GetWeather,0
how cold is it going to be in san marcial  ak in one second,GetWeather,0
on april 2nd what will the weather be here,GetWeather,0
will it be warm in zambia at 9 pm,GetWeather,0
will it be warm next winter in smolan  burkina,GetWeather,0
add appreciation day to my folksy love,AddToPlaylist,0
what is the weather for cormorant  me,GetWeather,0
i would like you to add now the hits of winter 2008 onto my ntc studio sounds playlist ,AddToPlaylist,0
add butterfly house to nu metal,AddToPlaylist,0
the ultimate 90s needs avant que l’ombre à bercy in it ,AddToPlaylist,0
add my album to this is al green,AddToPlaylist,0
put once bitten twice bitten into the pulse of americana,AddToPlaylist,0
add doing all right to string theory,AddToPlaylist,0
add a tune by louis wolfe gilbert to my cleaning playlist,AddToPlaylist,0
will it be hotter on oct  the 20th in massachusetts,GetWeather,0
can you add danny carey to my masters of metal playlist,AddToPlaylist,0
add morten harket to this is puccini,AddToPlaylist,0
add paper doll to the power walk playlist,AddToPlaylist,0
what will the weather be within the same area of weir farm national historic site,GetWeather,0
what s the weather far from jarbidge,GetWeather,0
is it warmer now in wetumpka  mauritania,GetWeather,0
what is the weather of la at 4 pm,GetWeather,0
on april the twelfth in somalia is the weather chilly,GetWeather,0
will there be sun at four pm at runkaus strict nature reserve,GetWeather,0
add track by fleetwood mac to lakeisha s playlist todo novedades,AddToPlaylist,0
add roots of the outsiders to blues roots,AddToPlaylist,0
i d like to add this album to funtime ,AddToPlaylist,0
can you put this tune onto erin s house afterwork playlist,AddToPlaylist,0
is it going to be hot in luambe-nationalpark,GetWeather,0
will it blizzard today in sint maarten,GetWeather,0
is it going to be cold 21 weeks and a half from now in salemburg,GetWeather,0
add this track to my zen focus playlist,AddToPlaylist,0
add the tune to my women of latin music playlist ,AddToPlaylist,0
is it warmer in lothian island wildlife sanctuary,GetWeather,0
weather for my nearby current location,GetWeather,0
tell me the weather forecast nearby my current location,GetWeather,0
will it be warmer in 20 minutes at natural park of las batuecas,GetWeather,0
